2025-11-23 09:10:14,333 - INFO - Using device: cuda:0
2025-11-23 09:10:14,333 - INFO - Loaded in-place augmentation: quantize
2025-11-23 09:10:14,333 - INFO - Loaded in-place augmentation: resize
2025-11-23 09:10:14,333 - INFO - Processing videos to extract frames...
2025-11-23 09:10:14,361 - INFO - Loading existing augmented frames for random_resize_crop on recordings_17_enrollment01_multi_playing01
2025-11-23 09:10:14,368 - INFO - Loading existing augmented frames for flip on recordings_17_enrollment01_multi_playing01
2025-11-23 09:10:14,394 - INFO - Loading existing augmented frames for random_resize_crop on recordings_06_enrollment02_multi_playing02
2025-11-23 09:10:14,401 - INFO - Loading existing augmented frames for flip on recordings_06_enrollment02_multi_playing02
2025-11-23 09:10:14,428 - INFO - Loading existing augmented frames for random_resize_crop on recordings_21_enrollment01_multi_playing01
2025-11-23 09:10:14,434 - INFO - Loading existing augmented frames for flip on recordings_21_enrollment01_multi_playing01
2025-11-23 09:10:14,538 - INFO - Loading existing augmented frames for random_resize_crop on recordings_01_enrollment01_multi_playing01
2025-11-23 09:10:14,543 - INFO - Loading existing augmented frames for flip on recordings_01_enrollment01_multi_playing01
2025-11-23 09:10:14,568 - INFO - Loading existing augmented frames for random_resize_crop on recordings_20_enrollment01_multi_playing01
2025-11-23 09:10:14,573 - INFO - Loading existing augmented frames for flip on recordings_20_enrollment01_multi_playing01
2025-11-23 09:10:14,599 - INFO - Loading existing augmented frames for random_resize_crop on recordings_04_enrollment01_multi_playing01
2025-11-23 09:10:14,606 - INFO - Loading existing augmented frames for flip on recordings_04_enrollment01_multi_playing01
2025-11-23 09:10:14,633 - INFO - Loading existing augmented frames for random_resize_crop on recordings_04_enrollment02_multi_playing02
2025-11-23 09:10:14,639 - INFO - Loading existing augmented frames for flip on recordings_04_enrollment02_multi_playing02
2025-11-23 09:10:14,664 - INFO - Loading existing augmented frames for random_resize_crop on recordings_20_enrollment02_multi_playing02
2025-11-23 09:10:14,669 - INFO - Loading existing augmented frames for flip on recordings_20_enrollment02_multi_playing02
2025-11-23 09:10:14,694 - INFO - Loading existing augmented frames for random_resize_crop on recordings_19_enrollment02_multi_playing02
2025-11-23 09:10:14,795 - INFO - Loading existing augmented frames for flip on recordings_19_enrollment02_multi_playing02
2025-11-23 09:10:14,821 - INFO - Loading existing augmented frames for random_resize_crop on recordings_23_enrollment02_multi_playing02
2025-11-23 09:10:14,829 - INFO - Loading existing augmented frames for flip on recordings_23_enrollment02_multi_playing02
2025-11-23 09:10:14,859 - INFO - Loading existing augmented frames for random_resize_crop on recordings_10_enrollment01_multi_playing01
2025-11-23 09:10:14,867 - INFO - Loading existing augmented frames for flip on recordings_10_enrollment01_multi_playing01
2025-11-23 09:10:14,895 - INFO - Loading existing augmented frames for random_resize_crop on recordings_10_enrollment02_multi_playing02
2025-11-23 09:10:14,904 - INFO - Loading existing augmented frames for flip on recordings_10_enrollment02_multi_playing02
2025-11-23 09:10:14,933 - INFO - Loading existing augmented frames for random_resize_crop on recordings_06_enrollment01_multi_playing01
2025-11-23 09:10:14,942 - INFO - Loading existing augmented frames for flip on recordings_06_enrollment01_multi_playing01
2025-11-23 09:10:14,969 - INFO - Loading existing augmented frames for random_resize_crop on recordings_19_enrollment01_multi_playing01
2025-11-23 09:10:15,088 - INFO - Loading existing augmented frames for flip on recordings_19_enrollment01_multi_playing01
2025-11-23 09:10:15,113 - INFO - Loading existing augmented frames for random_resize_crop on recordings_17_enrollment02_multi_playing02
2025-11-23 09:10:15,118 - INFO - Loading existing augmented frames for flip on recordings_17_enrollment02_multi_playing02
2025-11-23 09:10:15,141 - INFO - Loading existing augmented frames for random_resize_crop on recordings_01_enrollment03_multi_playing03
2025-11-23 09:10:15,147 - INFO - Loading existing augmented frames for flip on recordings_01_enrollment03_multi_playing03
2025-11-23 09:10:15,171 - INFO - Loading existing augmented frames for random_resize_crop on recordings_05_enrollment02_multi_playing02
2025-11-23 09:10:15,177 - INFO - Loading existing augmented frames for flip on recordings_05_enrollment02_multi_playing02
2025-11-23 09:10:15,204 - INFO - Loading existing augmented frames for random_resize_crop on recordings_21_enrollment02_multi_playing02
2025-11-23 09:10:15,212 - INFO - Loading existing augmented frames for flip on recordings_21_enrollment02_multi_playing02
2025-11-23 09:10:15,242 - INFO - Loading existing augmented frames for random_resize_crop on recordings_25_enrollment02_multi_playing02
2025-11-23 09:10:15,249 - INFO - Loading existing augmented frames for flip on recordings_25_enrollment02_multi_playing02
2025-11-23 09:10:15,278 - INFO - Loading existing augmented frames for random_resize_crop on recordings_25_enrollment01_multi_playing01
2025-11-23 09:10:15,285 - INFO - Loading existing augmented frames for flip on recordings_25_enrollment01_multi_playing01
2025-11-23 09:10:15,311 - INFO - Loading existing augmented frames for random_resize_crop on recordings_23_enrollment01_multi_playing01
2025-11-23 09:10:15,453 - INFO - Loading existing augmented frames for flip on recordings_23_enrollment01_multi_playing01
2025-11-23 09:10:15,477 - INFO - Loading existing augmented frames for random_resize_crop on recordings_01_enrollment02_multi_playing02
2025-11-23 09:10:15,482 - INFO - Loading existing augmented frames for flip on recordings_01_enrollment02_multi_playing02
2025-11-23 09:10:15,506 - INFO - Loading existing augmented frames for random_resize_crop on recordings_05_enrollment01_multi_playing01
2025-11-23 09:10:15,511 - INFO - Loading existing augmented frames for flip on recordings_05_enrollment01_multi_playing01
2025-11-23 09:10:15,538 - INFO - Loading existing augmented frames for random_resize_crop on recordings_24_enrollment02_multi_playing02
2025-11-23 09:10:15,544 - INFO - Loading existing augmented frames for flip on recordings_24_enrollment02_multi_playing02
2025-11-23 09:10:15,572 - INFO - Loading existing augmented frames for random_resize_crop on recordings_24_enrollment01_multi_playing01
2025-11-23 09:10:15,580 - INFO - Loading existing augmented frames for flip on recordings_24_enrollment01_multi_playing01
2025-11-23 09:10:15,585 - INFO - Dataset initialized with 75 video pairs.
2025-11-23 09:10:15,587 - INFO - Train samples: 55497, Val samples: 10263
2025-11-23 09:10:15,830 - INFO - Using class weights: [0.1 1.  1.  1.  1.  1.  1.  1. ]
2025-11-23 09:10:15,830 - INFO - 
============================================================
Starting Training for 50 Epochs
============================================================
2025-11-23 09:10:15,830 - INFO - 
--- Epoch 1/50 ---
Train: 100%|██████████████████████████████████████████████████████████████████████████████████████████████████████████████████████████████████| 5550/5550 [03:42<00:00, 24.99it/s]
2025-11-23 09:13:57,902 - INFO - Epoch 1 Train - Loss: 0.1374, Accuracy: 0.9453, Precision: 0.9007, Recall: 0.9473
Val  : 100%|██████████████████████████████████████████████████████████████████████████████████████████████████████████████████████████████████| 1027/1027 [00:20<00:00, 50.00it/s]
2025-11-23 09:14:18,443 - INFO - Epoch 1 Val   - Loss: 1.0100, Accuracy: 0.7952, Precision: 0.6922, Recall: 0.7749
2025-11-23 09:14:18,444 - INFO - New best model saved.
2025-11-23 09:14:18,444 - INFO - 
--- Epoch 2/50 ---
Train: 100%|██████████████████████████████████████████████████████████████████████████████████████████████████████████████████████████████████| 5550/5550 [03:45<00:00, 24.62it/s]
2025-11-23 09:18:03,912 - INFO - Epoch 2 Train - Loss: 0.0765, Accuracy: 0.9699, Precision: 0.9343, Recall: 0.9636
Val  : 100%|██████████████████████████████████████████████████████████████████████████████████████████████████████████████████████████████████| 1027/1027 [00:21<00:00, 47.52it/s]
2025-11-23 09:18:25,527 - INFO - Epoch 2 Val   - Loss: 1.0850, Accuracy: 0.8021, Precision: 0.6913, Recall: 0.7763
2025-11-23 09:18:25,527 - INFO - 
--- Epoch 3/50 ---
Train: 100%|██████████████████████████████████████████████████████████████████████████████████████████████████████████████████████████████████| 5550/5550 [03:46<00:00, 24.47it/s]
2025-11-23 09:22:12,376 - INFO - Epoch 3 Train - Loss: 0.0703, Accuracy: 0.9725, Precision: 0.9390, Recall: 0.9658
Val  : 100%|██████████████████████████████████████████████████████████████████████████████████████████████████████████████████████████████████| 1027/1027 [00:22<00:00, 45.77it/s]
2025-11-23 09:22:34,817 - INFO - Epoch 3 Val   - Loss: 1.2421, Accuracy: 0.7912, Precision: 0.6840, Recall: 0.7560
2025-11-23 09:22:34,817 - INFO - 
--- Epoch 4/50 ---
Train: 100%|██████████████████████████████████████████████████████████████████████████████████████████████████████████████████████████████████| 5550/5550 [03:48<00:00, 24.24it/s]
2025-11-23 09:26:23,760 - INFO - Epoch 4 Train - Loss: 0.0665, Accuracy: 0.9740, Precision: 0.9419, Recall: 0.9671
Val  : 100%|██████████████████████████████████████████████████████████████████████████████████████████████████████████████████████████████████| 1027/1027 [00:21<00:00, 47.28it/s]
2025-11-23 09:26:45,485 - INFO - Epoch 4 Val   - Loss: 1.3145, Accuracy: 0.7831, Precision: 0.6760, Recall: 0.7585
2025-11-23 09:26:45,485 - INFO - 
--- Epoch 5/50 ---
Train: 100%|██████████████████████████████████████████████████████████████████████████████████████████████████████████████████████████████████| 5550/5550 [03:48<00:00, 24.32it/s]
2025-11-23 09:30:33,658 - INFO - Epoch 5 Train - Loss: 0.0637, Accuracy: 0.9751, Precision: 0.9441, Recall: 0.9682
Val  : 100%|██████████████████████████████████████████████████████████████████████████████████████████████████████████████████████████████████| 1027/1027 [00:21<00:00, 48.27it/s]
2025-11-23 09:30:54,936 - INFO - Epoch 5 Val   - Loss: 1.3542, Accuracy: 0.7779, Precision: 0.6661, Recall: 0.7463
2025-11-23 09:30:54,936 - INFO - 
--- Epoch 6/50 ---
Train: 100%|██████████████████████████████████████████████████████████████████████████████████████████████████████████████████████████████████| 5550/5550 [03:50<00:00, 24.07it/s]
2025-11-23 09:34:45,493 - INFO - Epoch 6 Train - Loss: 0.0614, Accuracy: 0.9761, Precision: 0.9459, Recall: 0.9691
Val  : 100%|██████████████████████████████████████████████████████████████████████████████████████████████████████████████████████████████████| 1027/1027 [00:22<00:00, 45.77it/s]
2025-11-23 09:35:07,935 - INFO - Epoch 6 Val   - Loss: 1.4295, Accuracy: 0.7877, Precision: 0.6743, Recall: 0.7499
2025-11-23 09:35:07,935 - INFO - 
--- Epoch 7/50 ---
Train: 100%|██████████████████████████████████████████████████████████████████████████████████████████████████████████████████████████████████| 5550/5550 [03:50<00:00, 24.04it/s]
2025-11-23 09:38:58,803 - INFO - Epoch 7 Train - Loss: 0.0594, Accuracy: 0.9769, Precision: 0.9474, Recall: 0.9698
Val  : 100%|██████████████████████████████████████████████████████████████████████████████████████████████████████████████████████████████████| 1027/1027 [00:22<00:00, 45.78it/s]
2025-11-23 09:39:21,236 - INFO - Epoch 7 Val   - Loss: 1.6542, Accuracy: 0.7756, Precision: 0.6708, Recall: 0.7325
2025-11-23 09:39:21,236 - INFO - 
--- Epoch 8/50 ---
Train: 100%|██████████████████████████████████████████████████████████████████████████████████████████████████████████████████████████████████| 5550/5550 [03:51<00:00, 24.02it/s]
2025-11-23 09:43:12,283 - INFO - Epoch 8 Train - Loss: 0.0577, Accuracy: 0.9776, Precision: 0.9488, Recall: 0.9705
Val  : 100%|██████████████████████████████████████████████████████████████████████████████████████████████████████████████████████████████████| 1027/1027 [00:22<00:00, 45.05it/s]
2025-11-23 09:43:35,079 - INFO - Epoch 8 Val   - Loss: 1.7023, Accuracy: 0.7759, Precision: 0.6645, Recall: 0.7306
2025-11-23 09:43:35,079 - INFO - 
--- Epoch 9/50 ---
Train: 100%|██████████████████████████████████████████████████████████████████████████████████████████████████████████████████████████████████| 5550/5550 [03:51<00:00, 24.02it/s]
2025-11-23 09:47:26,136 - INFO - Epoch 9 Train - Loss: 0.0561, Accuracy: 0.9783, Precision: 0.9501, Recall: 0.9711
Val  : 100%|██████████████████████████████████████████████████████████████████████████████████████████████████████████████████████████████████| 1027/1027 [00:22<00:00, 45.77it/s]
2025-11-23 09:47:48,573 - INFO - Epoch 9 Val   - Loss: 1.7209, Accuracy: 0.7744, Precision: 0.6652, Recall: 0.7348
2025-11-23 09:47:48,573 - INFO - 
--- Epoch 10/50 ---
Train: 100%|██████████████████████████████████████████████████████████████████████████████████████████████████████████████████████████████████| 5550/5550 [03:50<00:00, 24.04it/s]
2025-11-23 09:51:39,445 - INFO - Epoch 10 Train - Loss: 0.0547, Accuracy: 0.9789, Precision: 0.9513, Recall: 0.9717
Val  : 100%|██████████████████████████████████████████████████████████████████████████████████████████████████████████████████████████████████| 1027/1027 [00:21<00:00, 47.17it/s]
2025-11-23 09:52:01,217 - INFO - Epoch 10 Val   - Loss: 1.6707, Accuracy: 0.7820, Precision: 0.6747, Recall: 0.7431
2025-11-23 09:52:01,217 - INFO - 
--- Epoch 11/50 ---
Train: 100%|██████████████████████████████████████████████████████████████████████████████████████████████████████████████████████████████████| 5550/5550 [03:49<00:00, 24.14it/s]
2025-11-23 09:55:51,097 - INFO - Epoch 11 Train - Loss: 0.0534, Accuracy: 0.9794, Precision: 0.9524, Recall: 0.9722
Val  : 100%|██████████████████████████████████████████████████████████████████████████████████████████████████████████████████████████████████| 1027/1027 [00:22<00:00, 46.17it/s]
2025-11-23 09:56:13,342 - INFO - Epoch 11 Val   - Loss: 1.8006, Accuracy: 0.7775, Precision: 0.6675, Recall: 0.7312
2025-11-23 09:56:13,342 - INFO - 
--- Epoch 12/50 ---
Train: 100%|██████████████████████████████████████████████████████████████████████████████████████████████████████████████████████████████████| 5550/5550 [03:49<00:00, 24.18it/s]
2025-11-23 10:00:02,842 - INFO - Epoch 12 Train - Loss: 0.0523, Accuracy: 0.9799, Precision: 0.9533, Recall: 0.9726
Val  : 100%|██████████████████████████████████████████████████████████████████████████████████████████████████████████████████████████████████| 1027/1027 [00:21<00:00, 46.85it/s]
2025-11-23 10:00:24,764 - INFO - Epoch 12 Val   - Loss: 1.6520, Accuracy: 0.7878, Precision: 0.6787, Recall: 0.7474
2025-11-23 10:00:24,764 - INFO - 
--- Epoch 13/50 ---
Train: 100%|██████████████████████████████████████████████████████████████████████████████████████████████████████████████████████████████████| 5550/5550 [03:49<00:00, 24.21it/s]
2025-11-23 10:04:13,989 - INFO - Epoch 13 Train - Loss: 0.0513, Accuracy: 0.9803, Precision: 0.9542, Recall: 0.9730
Val  : 100%|██████████████████████████████████████████████████████████████████████████████████████████████████████████████████████████████████| 1027/1027 [00:22<00:00, 45.66it/s]
2025-11-23 10:04:36,483 - INFO - Epoch 13 Val   - Loss: 1.6892, Accuracy: 0.7832, Precision: 0.6728, Recall: 0.7477
2025-11-23 10:04:36,483 - INFO - 
--- Epoch 14/50 ---
Train: 100%|██████████████████████████████████████████████████████████████████████████████████████████████████████████████████████████████████| 5550/5550 [03:49<00:00, 24.14it/s]
2025-11-23 10:08:26,419 - INFO - Epoch 14 Train - Loss: 0.0503, Accuracy: 0.9807, Precision: 0.9550, Recall: 0.9734
Val  : 100%|██████████████████████████████████████████████████████████████████████████████████████████████████████████████████████████████████| 1027/1027 [00:23<00:00, 43.90it/s]
2025-11-23 10:08:49,817 - INFO - Epoch 14 Val   - Loss: 1.7609, Accuracy: 0.7840, Precision: 0.6706, Recall: 0.7426
2025-11-23 10:08:49,817 - INFO - 
--- Epoch 15/50 ---
Train: 100%|██████████████████████████████████████████████████████████████████████████████████████████████████████████████████████████████████| 5550/5550 [03:49<00:00, 24.17it/s]
2025-11-23 10:12:39,419 - INFO - Epoch 15 Train - Loss: 0.0494, Accuracy: 0.9810, Precision: 0.9558, Recall: 0.9738
Val  : 100%|██████████████████████████████████████████████████████████████████████████████████████████████████████████████████████████████████| 1027/1027 [00:22<00:00, 45.78it/s]
2025-11-23 10:13:01,852 - INFO - Epoch 15 Val   - Loss: 1.7849, Accuracy: 0.7877, Precision: 0.6778, Recall: 0.7464
2025-11-23 10:13:01,852 - INFO - 
--- Epoch 16/50 ---
Train: 100%|██████████████████████████████████████████████████████████████████████████████████████████████████████████████████████████████████| 5550/5550 [03:49<00:00, 24.22it/s]
2025-11-23 10:16:51,007 - INFO - Epoch 16 Train - Loss: 0.0486, Accuracy: 0.9814, Precision: 0.9564, Recall: 0.9741
Val  : 100%|██████████████████████████████████████████████████████████████████████████████████████████████████████████████████████████████████| 1027/1027 [00:21<00:00, 47.13it/s]
2025-11-23 10:17:12,798 - INFO - Epoch 16 Val   - Loss: 1.8845, Accuracy: 0.7800, Precision: 0.6711, Recall: 0.7405
2025-11-23 10:17:12,798 - INFO - 
--- Epoch 17/50 ---
Train: 100%|██████████████████████████████████████████████████████████████████████████████████████████████████████████████████████████████████| 5550/5550 [03:49<00:00, 24.17it/s]
2025-11-23 10:21:02,465 - INFO - Epoch 17 Train - Loss: 0.0479, Accuracy: 0.9816, Precision: 0.9571, Recall: 0.9745
Val  : 100%|██████████████████████████████████████████████████████████████████████████████████████████████████████████████████████████████████| 1027/1027 [00:22<00:00, 46.62it/s]
2025-11-23 10:21:24,496 - INFO - Epoch 17 Val   - Loss: 1.7499, Accuracy: 0.7873, Precision: 0.6759, Recall: 0.7497
2025-11-23 10:21:24,496 - INFO - 
--- Epoch 18/50 ---
Train: 100%|██████████████████████████████████████████████████████████████████████████████████████████████████████████████████████████████████| 5550/5550 [03:50<00:00, 24.13it/s]
2025-11-23 10:25:14,524 - INFO - Epoch 18 Train - Loss: 0.0472, Accuracy: 0.9819, Precision: 0.9577, Recall: 0.9748
Val  : 100%|██████████████████████████████████████████████████████████████████████████████████████████████████████████████████████████████████| 1027/1027 [00:22<00:00, 46.18it/s]
2025-11-23 10:25:36,762 - INFO - Epoch 18 Val   - Loss: 1.9206, Accuracy: 0.7810, Precision: 0.6704, Recall: 0.7375
2025-11-23 10:25:36,762 - INFO - 
--- Epoch 19/50 ---
Train: 100%|██████████████████████████████████████████████████████████████████████████████████████████████████████████████████████████████████| 5550/5550 [03:49<00:00, 24.23it/s]
2025-11-23 10:29:25,848 - INFO - Epoch 19 Train - Loss: 0.0465, Accuracy: 0.9822, Precision: 0.9583, Recall: 0.9750
Val  : 100%|██████████████████████████████████████████████████████████████████████████████████████████████████████████████████████████████████| 1027/1027 [00:22<00:00, 45.57it/s]
2025-11-23 10:29:48,385 - INFO - Epoch 19 Val   - Loss: 1.9218, Accuracy: 0.7810, Precision: 0.6693, Recall: 0.7386
2025-11-23 10:29:48,385 - INFO - 
--- Epoch 20/50 ---
Train: 100%|██████████████████████████████████████████████████████████████████████████████████████████████████████████████████████████████████| 5550/5550 [03:50<00:00, 24.12it/s]
2025-11-23 10:33:38,450 - INFO - Epoch 20 Train - Loss: 0.0459, Accuracy: 0.9824, Precision: 0.9588, Recall: 0.9753
Val  : 100%|██████████████████████████████████████████████████████████████████████████████████████████████████████████████████████████████████| 1027/1027 [00:22<00:00, 45.06it/s]
2025-11-23 10:34:01,245 - INFO - Epoch 20 Val   - Loss: 1.9304, Accuracy: 0.7847, Precision: 0.6736, Recall: 0.7453
2025-11-23 10:34:01,245 - INFO - 
--- Epoch 21/50 ---
Train: 100%|██████████████████████████████████████████████████████████████████████████████████████████████████████████████████████████████████| 5550/5550 [03:50<00:00, 24.03it/s]
2025-11-23 10:37:52,175 - INFO - Epoch 21 Train - Loss: 0.0454, Accuracy: 0.9827, Precision: 0.9593, Recall: 0.9755
Val  : 100%|██████████████████████████████████████████████████████████████████████████████████████████████████████████████████████████████████| 1027/1027 [00:23<00:00, 44.30it/s]
2025-11-23 10:38:15,362 - INFO - Epoch 21 Val   - Loss: 1.8850, Accuracy: 0.7874, Precision: 0.6764, Recall: 0.7477
2025-11-23 10:38:15,362 - INFO - 
--- Epoch 22/50 ---
Train: 100%|██████████████████████████████████████████████████████████████████████████████████████████████████████████████████████████████████| 5550/5550 [03:50<00:00, 24.08it/s]
2025-11-23 10:42:05,865 - INFO - Epoch 22 Train - Loss: 0.0448, Accuracy: 0.9829, Precision: 0.9598, Recall: 0.9758
Val  : 100%|██████████████████████████████████████████████████████████████████████████████████████████████████████████████████████████████████| 1027/1027 [00:23<00:00, 44.20it/s]
2025-11-23 10:42:29,099 - INFO - Epoch 22 Val   - Loss: 2.0635, Accuracy: 0.7820, Precision: 0.6707, Recall: 0.7387
2025-11-23 10:42:29,099 - INFO - 
--- Epoch 23/50 ---
Train: 100%|██████████████████████████████████████████████████████████████████████████████████████████████████████████████████████████████████| 5550/5550 [03:50<00:00, 24.05it/s]
2025-11-23 10:46:19,906 - INFO - Epoch 23 Train - Loss: 0.0443, Accuracy: 0.9831, Precision: 0.9602, Recall: 0.9760
Val  : 100%|██████████████████████████████████████████████████████████████████████████████████████████████████████████████████████████████████| 1027/1027 [00:22<00:00, 46.09it/s]
2025-11-23 10:46:42,192 - INFO - Epoch 23 Val   - Loss: 2.0442, Accuracy: 0.7802, Precision: 0.6700, Recall: 0.7376
2025-11-23 10:46:42,192 - INFO - 
--- Epoch 24/50 ---
Train: 100%|██████████████████████████████████████████████████████████████████████████████████████████████████████████████████████████████████| 5550/5550 [03:50<00:00, 24.06it/s]
2025-11-23 10:50:32,841 - INFO - Epoch 24 Train - Loss: 0.0438, Accuracy: 0.9833, Precision: 0.9606, Recall: 0.9762
Val  : 100%|██████████████████████████████████████████████████████████████████████████████████████████████████████████████████████████████████| 1027/1027 [00:22<00:00, 45.34it/s]
2025-11-23 10:50:55,492 - INFO - Epoch 24 Val   - Loss: 2.0234, Accuracy: 0.7839, Precision: 0.6737, Recall: 0.7438
2025-11-23 10:50:55,492 - INFO - 
--- Epoch 25/50 ---
Train: 100%|██████████████████████████████████████████████████████████████████████████████████████████████████████████████████████████████████| 5550/5550 [03:49<00:00, 24.19it/s]
2025-11-23 10:54:44,889 - INFO - Epoch 25 Train - Loss: 0.0434, Accuracy: 0.9835, Precision: 0.9610, Recall: 0.9764
Val  : 100%|██████████████████████████████████████████████████████████████████████████████████████████████████████████████████████████████████| 1027/1027 [00:22<00:00, 46.52it/s]
2025-11-23 10:55:06,965 - INFO - Epoch 25 Val   - Loss: 2.0856, Accuracy: 0.7849, Precision: 0.6738, Recall: 0.7369
2025-11-23 10:55:06,966 - INFO - 
--- Epoch 26/50 ---
Train: 100%|██████████████████████████████████████████████████████████████████████████████████████████████████████████████████████████████████| 5550/5550 [03:49<00:00, 24.23it/s]
2025-11-23 10:58:56,033 - INFO - Epoch 26 Train - Loss: 0.0430, Accuracy: 0.9836, Precision: 0.9614, Recall: 0.9766
Val  : 100%|██████████████████████████████████████████████████████████████████████████████████████████████████████████████████████████████████| 1027/1027 [00:21<00:00, 47.59it/s]
2025-11-23 10:59:17,615 - INFO - Epoch 26 Val   - Loss: 2.1051, Accuracy: 0.7853, Precision: 0.6750, Recall: 0.7449
2025-11-23 10:59:17,615 - INFO - 
--- Epoch 27/50 ---
Train: 100%|██████████████████████████████████████████████████████████████████████████████████████████████████████████████████████████████████| 5550/5550 [03:49<00:00, 24.21it/s]
2025-11-23 11:03:06,845 - INFO - Epoch 27 Train - Loss: 0.0426, Accuracy: 0.9838, Precision: 0.9617, Recall: 0.9768
Val  : 100%|██████████████████████████████████████████████████████████████████████████████████████████████████████████████████████████████████| 1027/1027 [00:22<00:00, 45.49it/s]
2025-11-23 11:03:29,422 - INFO - Epoch 27 Val   - Loss: 2.0911, Accuracy: 0.7877, Precision: 0.6734, Recall: 0.7432
2025-11-23 11:03:29,422 - INFO - 
--- Epoch 28/50 ---
Train: 100%|██████████████████████████████████████████████████████████████████████████████████████████████████████████████████████████████████| 5550/5550 [03:49<00:00, 24.16it/s]
2025-11-23 11:07:19,187 - INFO - Epoch 28 Train - Loss: 0.0422, Accuracy: 0.9839, Precision: 0.9621, Recall: 0.9770
Val  : 100%|██████████████████████████████████████████████████████████████████████████████████████████████████████████████████████████████████| 1027/1027 [00:21<00:00, 47.76it/s]
2025-11-23 11:07:40,693 - INFO - Epoch 28 Val   - Loss: 2.1628, Accuracy: 0.7843, Precision: 0.6713, Recall: 0.7377
2025-11-23 11:07:40,693 - INFO - 
--- Epoch 29/50 ---
Train: 100%|██████████████████████████████████████████████████████████████████████████████████████████████████████████████████████████████████| 5550/5550 [03:50<00:00, 24.09it/s]
2025-11-23 11:11:31,077 - INFO - Epoch 29 Train - Loss: 0.0418, Accuracy: 0.9841, Precision: 0.9624, Recall: 0.9771
Val  : 100%|██████████████████████████████████████████████████████████████████████████████████████████████████████████████████████████████████| 1027/1027 [00:22<00:00, 46.36it/s]
2025-11-23 11:11:53,231 - INFO - Epoch 29 Val   - Loss: 2.1038, Accuracy: 0.7851, Precision: 0.6740, Recall: 0.7384
2025-11-23 11:11:53,231 - INFO - 
--- Epoch 30/50 ---
Train: 100%|██████████████████████████████████████████████████████████████████████████████████████████████████████████████████████████████████| 5550/5550 [03:48<00:00, 24.24it/s]
2025-11-23 11:15:42,198 - INFO - Epoch 30 Train - Loss: 0.0415, Accuracy: 0.9842, Precision: 0.9627, Recall: 0.9773
Val  : 100%|██████████████████████████████████████████████████████████████████████████████████████████████████████████████████████████████████| 1027/1027 [00:22<00:00, 46.60it/s]
2025-11-23 11:16:04,236 - INFO - Epoch 30 Val   - Loss: 2.0951, Accuracy: 0.7878, Precision: 0.6738, Recall: 0.7481
2025-11-23 11:16:04,237 - INFO - 
--- Epoch 31/50 ---
Train: 100%|██████████████████████████████████████████████████████████████████████████████████████████████████████████████████████████████████| 5550/5550 [03:50<00:00, 24.10it/s]
2025-11-23 11:19:54,552 - INFO - Epoch 31 Train - Loss: 0.0412, Accuracy: 0.9843, Precision: 0.9630, Recall: 0.9774
Val  : 100%|██████████████████████████████████████████████████████████████████████████████████████████████████████████████████████████████████| 1027/1027 [00:22<00:00, 45.77it/s]
2025-11-23 11:20:16,993 - INFO - Epoch 31 Val   - Loss: 2.0904, Accuracy: 0.7881, Precision: 0.6756, Recall: 0.7456
2025-11-23 11:20:16,993 - INFO - 
--- Epoch 32/50 ---
Train: 100%|██████████████████████████████████████████████████████████████████████████████████████████████████████████████████████████████████| 5550/5550 [03:49<00:00, 24.18it/s]
2025-11-23 11:24:06,565 - INFO - Epoch 32 Train - Loss: 0.0408, Accuracy: 0.9845, Precision: 0.9633, Recall: 0.9776
Val  : 100%|██████████████████████████████████████████████████████████████████████████████████████████████████████████████████████████████████| 1027/1027 [00:22<00:00, 46.05it/s]
2025-11-23 11:24:28,866 - INFO - Epoch 32 Val   - Loss: 2.1545, Accuracy: 0.7861, Precision: 0.6729, Recall: 0.7431
2025-11-23 11:24:28,866 - INFO - 
--- Epoch 33/50 ---
Train: 100%|██████████████████████████████████████████████████████████████████████████████████████████████████████████████████████████████████| 5550/5550 [03:50<00:00, 24.12it/s]
2025-11-23 11:28:18,924 - INFO - Epoch 33 Train - Loss: 0.0405, Accuracy: 0.9846, Precision: 0.9636, Recall: 0.9777
Val  : 100%|██████████████████████████████████████████████████████████████████████████████████████████████████████████████████████████████████| 1027/1027 [00:21<00:00, 46.78it/s]
2025-11-23 11:28:40,880 - INFO - Epoch 33 Val   - Loss: 2.1622, Accuracy: 0.7861, Precision: 0.6742, Recall: 0.7439
2025-11-23 11:28:40,880 - INFO - 
--- Epoch 34/50 ---
Train: 100%|██████████████████████████████████████████████████████████████████████████████████████████████████████████████████████████████████| 5550/5550 [03:49<00:00, 24.20it/s]
2025-11-23 11:32:30,220 - INFO - Epoch 34 Train - Loss: 0.0402, Accuracy: 0.9847, Precision: 0.9638, Recall: 0.9779
Val  : 100%|██████████████████████████████████████████████████████████████████████████████████████████████████████████████████████████████████| 1027/1027 [00:22<00:00, 46.28it/s]
2025-11-23 11:32:52,414 - INFO - Epoch 34 Val   - Loss: 2.1546, Accuracy: 0.7874, Precision: 0.6742, Recall: 0.7443
2025-11-23 11:32:52,414 - INFO - 
--- Epoch 35/50 ---
Train: 100%|██████████████████████████████████████████████████████████████████████████████████████████████████████████████████████████████████| 5550/5550 [03:50<00:00, 24.05it/s]
2025-11-23 11:36:43,207 - INFO - Epoch 35 Train - Loss: 0.0399, Accuracy: 0.9848, Precision: 0.9641, Recall: 0.9780
Val  : 100%|██████████████████████████████████████████████████████████████████████████████████████████████████████████████████████████████████| 1027/1027 [00:22<00:00, 45.90it/s]
2025-11-23 11:37:05,582 - INFO - Epoch 35 Val   - Loss: 2.2355, Accuracy: 0.7864, Precision: 0.6725, Recall: 0.7403
2025-11-23 11:37:05,582 - INFO - 
--- Epoch 36/50 ---
Train: 100%|██████████████████████████████████████████████████████████████████████████████████████████████████████████████████████████████████| 5550/5550 [03:50<00:00, 24.03it/s]
2025-11-23 11:40:56,518 - INFO - Epoch 36 Train - Loss: 0.0397, Accuracy: 0.9849, Precision: 0.9643, Recall: 0.9781
Val  : 100%|██████████████████████████████████████████████████████████████████████████████████████████████████████████████████████████████████| 1027/1027 [00:22<00:00, 45.33it/s]
2025-11-23 11:41:19,175 - INFO - Epoch 36 Val   - Loss: 2.3206, Accuracy: 0.7847, Precision: 0.6721, Recall: 0.7398
2025-11-23 11:41:19,175 - INFO - 
--- Epoch 37/50 ---
Train: 100%|██████████████████████████████████████████████████████████████████████████████████████████████████████████████████████████████████| 5550/5550 [03:50<00:00, 24.07it/s]
2025-11-23 11:45:09,756 - INFO - Epoch 37 Train - Loss: 0.0394, Accuracy: 0.9850, Precision: 0.9646, Recall: 0.9783
Val  : 100%|██████████████████████████████████████████████████████████████████████████████████████████████████████████████████████████████████| 1027/1027 [00:21<00:00, 47.12it/s]
2025-11-23 11:45:31,551 - INFO - Epoch 37 Val   - Loss: 2.2141, Accuracy: 0.7872, Precision: 0.6745, Recall: 0.7488
2025-11-23 11:45:31,551 - INFO - 
--- Epoch 38/50 ---
Train: 100%|██████████████████████████████████████████████████████████████████████████████████████████████████████████████████████████████████| 5550/5550 [03:49<00:00, 24.23it/s]
2025-11-23 11:49:20,602 - INFO - Epoch 38 Train - Loss: 0.0391, Accuracy: 0.9852, Precision: 0.9648, Recall: 0.9784
Val  : 100%|██████████████████████████████████████████████████████████████████████████████████████████████████████████████████████████████████| 1027/1027 [00:21<00:00, 46.73it/s]
2025-11-23 11:49:42,580 - INFO - Epoch 38 Val   - Loss: 2.2894, Accuracy: 0.7839, Precision: 0.6706, Recall: 0.7377
2025-11-23 11:49:42,580 - INFO - 
--- Epoch 39/50 ---
Train: 100%|██████████████████████████████████████████████████████████████████████████████████████████████████████████████████████████████████| 5550/5550 [03:49<00:00, 24.18it/s]
2025-11-23 11:53:32,084 - INFO - Epoch 39 Train - Loss: 0.0389, Accuracy: 0.9852, Precision: 0.9650, Recall: 0.9785
Val  : 100%|██████████████████████████████████████████████████████████████████████████████████████████████████████████████████████████████████| 1027/1027 [00:22<00:00, 45.30it/s]
2025-11-23 11:53:54,758 - INFO - Epoch 39 Val   - Loss: 2.2101, Accuracy: 0.7860, Precision: 0.6742, Recall: 0.7416
2025-11-23 11:53:54,758 - INFO - 
--- Epoch 40/50 ---
Train: 100%|██████████████████████████████████████████████████████████████████████████████████████████████████████████████████████████████████| 5550/5550 [03:49<00:00, 24.20it/s]
2025-11-23 11:57:44,112 - INFO - Epoch 40 Train - Loss: 0.0387, Accuracy: 0.9853, Precision: 0.9652, Recall: 0.9786
Val  : 100%|██████████████████████████████████████████████████████████████████████████████████████████████████████████████████████████████████| 1027/1027 [00:21<00:00, 46.77it/s]
2025-11-23 11:58:06,073 - INFO - Epoch 40 Val   - Loss: 2.3154, Accuracy: 0.7843, Precision: 0.6724, Recall: 0.7398
2025-11-23 11:58:06,073 - INFO - 
--- Epoch 41/50 ---
Train: 100%|██████████████████████████████████████████████████████████████████████████████████████████████████████████████████████████████████| 5550/5550 [03:48<00:00, 24.26it/s]
2025-11-23 12:01:54,837 - INFO - Epoch 41 Train - Loss: 0.0385, Accuracy: 0.9854, Precision: 0.9654, Recall: 0.9787
Val  : 100%|██████████████████████████████████████████████████████████████████████████████████████████████████████████████████████████████████| 1027/1027 [00:22<00:00, 46.36it/s]
2025-11-23 12:02:16,993 - INFO - Epoch 41 Val   - Loss: 2.3343, Accuracy: 0.7846, Precision: 0.6728, Recall: 0.7399
2025-11-23 12:02:16,993 - INFO - 
--- Epoch 42/50 ---
Train: 100%|██████████████████████████████████████████████████████████████████████████████████████████████████████████████████████████████████| 5550/5550 [03:50<00:00, 24.12it/s]
2025-11-23 12:06:07,125 - INFO - Epoch 42 Train - Loss: 0.0382, Accuracy: 0.9855, Precision: 0.9657, Recall: 0.9788
Val  : 100%|██████████████████████████████████████████████████████████████████████████████████████████████████████████████████████████████████| 1027/1027 [00:23<00:00, 43.92it/s]
2025-11-23 12:06:30,508 - INFO - Epoch 42 Val   - Loss: 2.2361, Accuracy: 0.7874, Precision: 0.6754, Recall: 0.7427
2025-11-23 12:06:30,508 - INFO - 
--- Epoch 43/50 ---
Train: 100%|██████████████████████████████████████████████████████████████████████████████████████████████████████████████████████████████████| 5550/5550 [03:50<00:00, 24.12it/s]
2025-11-23 12:10:20,641 - INFO - Epoch 43 Train - Loss: 0.0380, Accuracy: 0.9856, Precision: 0.9658, Recall: 0.9789
Val  : 100%|██████████████████████████████████████████████████████████████████████████████████████████████████████████████████████████████████| 1027/1027 [00:22<00:00, 46.25it/s]
2025-11-23 12:10:42,846 - INFO - Epoch 43 Val   - Loss: 2.3097, Accuracy: 0.7848, Precision: 0.6732, Recall: 0.7446
2025-11-23 12:10:42,846 - INFO - 
--- Epoch 44/50 ---
Train: 100%|██████████████████████████████████████████████████████████████████████████████████████████████████████████████████████████████████| 5550/5550 [03:49<00:00, 24.19it/s]
2025-11-23 12:14:32,287 - INFO - Epoch 44 Train - Loss: 0.0378, Accuracy: 0.9857, Precision: 0.9660, Recall: 0.9790
Val  : 100%|██████████████████████████████████████████████████████████████████████████████████████████████████████████████████████████████████| 1027/1027 [00:22<00:00, 46.03it/s]
2025-11-23 12:14:54,602 - INFO - Epoch 44 Val   - Loss: 2.2872, Accuracy: 0.7871, Precision: 0.6747, Recall: 0.7455
2025-11-23 12:14:54,602 - INFO - 
--- Epoch 45/50 ---
Train: 100%|██████████████████████████████████████████████████████████████████████████████████████████████████████████████████████████████████| 5550/5550 [03:50<00:00, 24.09it/s]
2025-11-23 12:18:44,963 - INFO - Epoch 45 Train - Loss: 0.0376, Accuracy: 0.9858, Precision: 0.9662, Recall: 0.9791
Val  : 100%|██████████████████████████████████████████████████████████████████████████████████████████████████████████████████████████████████| 1027/1027 [00:22<00:00, 45.45it/s]
2025-11-23 12:19:07,559 - INFO - Epoch 45 Val   - Loss: 2.3019, Accuracy: 0.7873, Precision: 0.6725, Recall: 0.7396
2025-11-23 12:19:07,559 - INFO - 
--- Epoch 46/50 ---
Train: 100%|██████████████████████████████████████████████████████████████████████████████████████████████████████████████████████████████████| 5550/5550 [03:49<00:00, 24.15it/s]
2025-11-23 12:22:57,330 - INFO - Epoch 46 Train - Loss: 0.0374, Accuracy: 0.9858, Precision: 0.9664, Recall: 0.9792
Val  : 100%|██████████████████████████████████████████████████████████████████████████████████████████████████████████████████████████████████| 1027/1027 [00:22<00:00, 45.71it/s]
2025-11-23 12:23:19,800 - INFO - Epoch 46 Val   - Loss: 2.3289, Accuracy: 0.7846, Precision: 0.6728, Recall: 0.7404
2025-11-23 12:23:19,800 - INFO - 
--- Epoch 47/50 ---
Train: 100%|██████████████████████████████████████████████████████████████████████████████████████████████████████████████████████████████████| 5550/5550 [03:50<00:00, 24.13it/s]
2025-11-23 12:27:09,809 - INFO - Epoch 47 Train - Loss: 0.0372, Accuracy: 0.9859, Precision: 0.9666, Recall: 0.9793
Val  : 100%|██████████████████████████████████████████████████████████████████████████████████████████████████████████████████████████████████| 1027/1027 [00:22<00:00, 46.66it/s]
2025-11-23 12:27:31,820 - INFO - Epoch 47 Val   - Loss: 2.4549, Accuracy: 0.7825, Precision: 0.6702, Recall: 0.7361
2025-11-23 12:27:31,820 - INFO - 
--- Epoch 48/50 ---
Train: 100%|██████████████████████████████████████████████████████████████████████████████████████████████████████████████████████████████████| 5550/5550 [03:48<00:00, 24.24it/s]
2025-11-23 12:31:20,804 - INFO - Epoch 48 Train - Loss: 0.0370, Accuracy: 0.9860, Precision: 0.9668, Recall: 0.9794
Val  : 100%|██████████████████████████████████████████████████████████████████████████████████████████████████████████████████████████████████| 1027/1027 [00:22<00:00, 45.41it/s]
2025-11-23 12:31:43,420 - INFO - Epoch 48 Val   - Loss: 2.3073, Accuracy: 0.7863, Precision: 0.6717, Recall: 0.7419
2025-11-23 12:31:43,420 - INFO - 
--- Epoch 49/50 ---
Train: 100%|██████████████████████████████████████████████████████████████████████████████████████████████████████████████████████████████████| 5550/5550 [03:50<00:00, 24.09it/s]
2025-11-23 12:35:33,782 - INFO - Epoch 49 Train - Loss: 0.0369, Accuracy: 0.9861, Precision: 0.9669, Recall: 0.9795
Val  : 100%|██████████████████████████████████████████████████████████████████████████████████████████████████████████████████████████████████| 1027/1027 [00:22<00:00, 45.17it/s]
2025-11-23 12:35:56,521 - INFO - Epoch 49 Val   - Loss: 2.3712, Accuracy: 0.7869, Precision: 0.6743, Recall: 0.7410
2025-11-23 12:35:56,521 - INFO - 
--- Epoch 50/50 ---
Train: 100%|██████████████████████████████████████████████████████████████████████████████████████████████████████████████████████████████████| 5550/5550 [03:50<00:00, 24.07it/s]
2025-11-23 12:39:47,093 - INFO - Epoch 50 Train - Loss: 0.0367, Accuracy: 0.9861, Precision: 0.9671, Recall: 0.9796
Val  : 100%|██████████████████████████████████████████████████████████████████████████████████████████████████████████████████████████████████| 1027/1027 [00:22<00:00, 45.96it/s]
2025-11-23 12:40:09,438 - INFO - Epoch 50 Val   - Loss: 2.3133, Accuracy: 0.7863, Precision: 0.6723, Recall: 0.7462
2025-11-23 12:40:09,531 - INFO - 
Saved best model (val_loss: 1.0100) to ./best_unet.pth
2025-11-23 12:40:09,531 - INFO - 
============================================================
2025-11-23 12:40:09,531 - INFO - TRAINING SUMMARY
2025-11-23 12:40:09,531 - INFO - ============================================================
2025-11-23 12:40:09,532 - INFO - Training subjects: ['01', '04', '06', '10', '17', '19', '20', '21', '23', '24'] (10 subjects)
2025-11-23 12:40:09,532 - INFO - Validation subjects: ['05', '25'] (2 subjects)
2025-11-23 12:40:09,532 - INFO - Training samples: 55497
2025-11-23 12:40:09,532 - INFO - Validation samples: 10263
2025-11-23 12:40:09,532 - INFO - 
Final Training Metrics:
2025-11-23 12:40:09,532 - INFO -   Loss:      0.0367
2025-11-23 12:40:09,532 - INFO -   Accuracy:  0.9861
2025-11-23 12:40:09,532 - INFO -   Precision: 0.9671
2025-11-23 12:40:09,532 - INFO -   Recall:    0.9796
2025-11-23 12:40:09,532 - INFO - 
Best Validation Metrics:
2025-11-23 12:40:09,532 - INFO -   Loss:      1.0100
2025-11-23 12:40:09,532 - INFO -   Accuracy:  0.7952
2025-11-23 12:40:09,532 - INFO -   Precision: 0.6922
2025-11-23 12:40:09,532 - INFO -   Recall:    0.7749
2025-11-23 12:40:09,532 - INFO - 
Best validation loss: 1.0100
2025-11-23 12:40:09,532 - INFO - 
Training complete!