2025-11-22 23:27:11,888 - INFO - Using device: cuda:0
2025-11-22 23:27:11,889 - INFO - Loaded in-place augmentation: quantize
2025-11-22 23:27:11,889 - INFO - Loaded in-place augmentation: resize
2025-11-22 23:27:11,889 - INFO - Loaded in-place augmentation: speckle
2025-11-22 23:27:11,890 - INFO - Loaded in-place augmentation: gamma
2025-11-22 23:27:11,890 - INFO - Processing videos to extract frames...
2025-11-22 23:27:12,019 - INFO - Loading existing augmented frames for random_resize_crop on recordings_24_enrollment01_multi_playing01
2025-11-22 23:27:12,251 - INFO - Loading existing augmented frames for random_resize_crop on recordings_04_enrollment02_multi_playing02
2025-11-22 23:27:12,566 - INFO - Loading existing augmented frames for random_resize_crop on recordings_01_enrollment02_multi_playing02
2025-11-22 23:27:12,716 - INFO - Loading existing augmented frames for random_resize_crop on recordings_19_enrollment01_multi_playing01
2025-11-22 23:27:13,056 - INFO - Loading existing augmented frames for random_resize_crop on recordings_25_enrollment01_multi_playing01
2025-11-22 23:27:13,425 - INFO - Loading existing augmented frames for random_resize_crop on recordings_10_enrollment01_multi_playing01
2025-11-22 23:27:13,825 - INFO - Loading existing augmented frames for random_resize_crop on recordings_25_enrollment02_multi_playing02
2025-11-22 23:27:13,988 - INFO - Loading existing augmented frames for random_resize_crop on recordings_21_enrollment01_multi_playing01
2025-11-22 23:27:14,241 - INFO - Loading existing augmented frames for random_resize_crop on recordings_01_enrollment03_multi_playing03
2025-11-22 23:27:14,400 - INFO - Loading existing augmented frames for random_resize_crop on recordings_06_enrollment01_multi_playing01
2025-11-22 23:27:14,719 - INFO - Loading existing augmented frames for random_resize_crop on recordings_05_enrollment02_multi_playing02
2025-11-22 23:27:14,798 - INFO - Loading existing augmented frames for random_resize_crop on recordings_17_enrollment01_multi_playing01
2025-11-22 23:27:14,870 - INFO - Loading existing augmented frames for random_resize_crop on recordings_20_enrollment02_multi_playing02
2025-11-22 23:27:14,951 - INFO - Loading existing augmented frames for random_resize_crop on recordings_06_enrollment02_multi_playing02
2025-11-22 23:27:15,039 - INFO - Loading existing augmented frames for random_resize_crop on recordings_20_enrollment01_multi_playing01
2025-11-22 23:27:15,116 - INFO - Loading existing augmented frames for random_resize_crop on recordings_10_enrollment02_multi_playing02
2025-11-22 23:27:15,482 - INFO - Loading existing augmented frames for random_resize_crop on recordings_19_enrollment02_multi_playing02
2025-11-22 23:27:15,708 - INFO - Loading existing augmented frames for random_resize_crop on recordings_01_enrollment01_multi_playing01
2025-11-22 23:27:15,827 - INFO - Loading existing augmented frames for random_resize_crop on recordings_21_enrollment02_multi_playing02
2025-11-22 23:27:15,917 - INFO - Loading existing augmented frames for random_resize_crop on recordings_23_enrollment01_multi_playing01
2025-11-22 23:27:15,998 - INFO - Loading existing augmented frames for random_resize_crop on recordings_04_enrollment01_multi_playing01
2025-11-22 23:27:16,075 - INFO - Loading existing augmented frames for random_resize_crop on recordings_17_enrollment02_multi_playing02
2025-11-22 23:27:16,155 - INFO - Loading existing augmented frames for random_resize_crop on recordings_24_enrollment02_multi_playing02
2025-11-22 23:27:16,229 - INFO - Loading existing augmented frames for random_resize_crop on recordings_05_enrollment01_multi_playing01
2025-11-22 23:27:16,664 - INFO - Loading existing augmented frames for random_resize_crop on recordings_23_enrollment02_multi_playing02
2025-11-22 23:27:16,680 - INFO - Dataset initialized with 50 video pairs.
2025-11-22 23:27:16,683 - INFO - Train samples: 37322, Val samples: 5810
2025-11-22 23:27:17,384 - INFO - Using class weights: [0.1 1.  1.  1.  1.  1.  1.  1. ]
2025-11-22 23:27:17,385 - INFO - 
============================================================
Starting Training for 100 Epochs
============================================================
2025-11-22 23:27:17,386 - INFO - 
--- Epoch 1/100 ---

Train: 100%|██████████| 4666/4666 [04:58<00:00, 15.65it/s]
2025-11-22 23:32:15,582 - INFO - Epoch 1 Train - Loss: 0.1507, Accuracy: 0.9391, Precision: 0.8872, Recall: 0.9448

Val  : 100%|██████████| 727/727 [00:34<00:00, 21.01it/s]
2025-11-22 23:32:50,180 - INFO - Epoch 1 Val   - Loss: 1.2947, Accuracy: 0.7532, Precision: 0.6587, Recall: 0.7418
2025-11-22 23:32:50,182 - INFO - New best model saved.
2025-11-22 23:32:50,182 - INFO - 
--- Epoch 2/100 ---

Train: 100%|██████████| 4666/4666 [04:55<00:00, 15.78it/s]
2025-11-22 23:37:45,819 - INFO - Epoch 2 Train - Loss: 0.0789, Accuracy: 0.9677, Precision: 0.9265, Recall: 0.9629

Val  : 100%|██████████| 727/727 [00:34<00:00, 21.17it/s]
2025-11-22 23:38:20,161 - INFO - Epoch 2 Val   - Loss: 1.3642, Accuracy: 0.7524, Precision: 0.6514, Recall: 0.7449
2025-11-22 23:38:20,161 - INFO - 
--- Epoch 3/100 ---

Train: 100%|██████████| 4666/4666 [04:57<00:00, 15.67it/s]
2025-11-22 23:43:17,884 - INFO - Epoch 3 Train - Loss: 0.0730, Accuracy: 0.9703, Precision: 0.9317, Recall: 0.9649

Val  : 100%|██████████| 727/727 [00:34<00:00, 21.09it/s]
2025-11-22 23:43:52,365 - INFO - Epoch 3 Val   - Loss: 1.6059, Accuracy: 0.7440, Precision: 0.6491, Recall: 0.7282
2025-11-22 23:43:52,365 - INFO - 
--- Epoch 4/100 ---

Train: 100%|██████████| 4666/4666 [04:57<00:00, 15.67it/s]
2025-11-22 23:48:50,057 - INFO - Epoch 4 Train - Loss: 0.0694, Accuracy: 0.9718, Precision: 0.9348, Recall: 0.9662

Val  : 100%|██████████| 727/727 [00:34<00:00, 21.05it/s]
2025-11-22 23:49:24,592 - INFO - Epoch 4 Val   - Loss: 1.5943, Accuracy: 0.7513, Precision: 0.6545, Recall: 0.7151
2025-11-22 23:49:24,592 - INFO - 
--- Epoch 5/100 ---

Train: 100%|██████████| 4666/4666 [04:56<00:00, 15.74it/s]
2025-11-22 23:54:21,069 - INFO - Epoch 5 Train - Loss: 0.0669, Accuracy: 0.9729, Precision: 0.9369, Recall: 0.9672

Val  : 100%|██████████| 727/727 [00:34<00:00, 20.80it/s]
2025-11-22 23:54:56,017 - INFO - Epoch 5 Val   - Loss: 1.5541, Accuracy: 0.7476, Precision: 0.6558, Recall: 0.7242
2025-11-22 23:54:56,017 - INFO - 
--- Epoch 6/100 ---

Train: 100%|██████████| 4666/4666 [04:57<00:00, 15.68it/s]
2025-11-22 23:59:53,509 - INFO - Epoch 6 Train - Loss: 0.0648, Accuracy: 0.9738, Precision: 0.9387, Recall: 0.9680

Val  : 100%|██████████| 727/727 [00:34<00:00, 20.81it/s]
2025-11-23 00:00:28,444 - INFO - Epoch 6 Val   - Loss: 1.6756, Accuracy: 0.7401, Precision: 0.6470, Recall: 0.7001
2025-11-23 00:00:28,444 - INFO - 
--- Epoch 7/100 ---

Train: 100%|██████████| 4666/4666 [04:58<00:00, 15.64it/s]
2025-11-23 00:05:26,863 - INFO - Epoch 7 Train - Loss: 0.0630, Accuracy: 0.9746, Precision: 0.9402, Recall: 0.9687

Val  : 100%|██████████| 727/727 [00:34<00:00, 20.87it/s]
2025-11-23 00:06:01,700 - INFO - Epoch 7 Val   - Loss: 1.8135, Accuracy: 0.7412, Precision: 0.6444, Recall: 0.7007
2025-11-23 00:06:01,700 - INFO - 
--- Epoch 8/100 ---

Train: 100%|██████████| 4666/4666 [04:58<00:00, 15.64it/s]
2025-11-23 00:11:00,118 - INFO - Epoch 8 Train - Loss: 0.0615, Accuracy: 0.9753, Precision: 0.9415, Recall: 0.9692

Val  : 100%|██████████| 727/727 [00:34<00:00, 20.93it/s]
2025-11-23 00:11:34,849 - INFO - Epoch 8 Val   - Loss: 1.6656, Accuracy: 0.7341, Precision: 0.6326, Recall: 0.7145
2025-11-23 00:11:34,849 - INFO - 
--- Epoch 9/100 ---

Train: 100%|██████████| 4666/4666 [04:59<00:00, 15.59it/s]
2025-11-23 00:16:34,138 - INFO - Epoch 9 Train - Loss: 0.0601, Accuracy: 0.9759, Precision: 0.9428, Recall: 0.9698

Val  : 100%|██████████| 727/727 [00:34<00:00, 20.87it/s]
2025-11-23 00:17:08,979 - INFO - Epoch 9 Val   - Loss: 1.7366, Accuracy: 0.7276, Precision: 0.6363, Recall: 0.6877
2025-11-23 00:17:08,979 - INFO - 
--- Epoch 10/100 ---

Train: 100%|██████████| 4666/4666 [04:58<00:00, 15.61it/s]
2025-11-23 00:22:07,851 - INFO - Epoch 10 Train - Loss: 0.0589, Accuracy: 0.9764, Precision: 0.9439, Recall: 0.9702

Val  : 100%|██████████| 727/727 [00:35<00:00, 20.71it/s]
2025-11-23 00:22:42,949 - INFO - Epoch 10 Val   - Loss: 1.7506, Accuracy: 0.7476, Precision: 0.6503, Recall: 0.7080
2025-11-23 00:22:42,949 - INFO - 
--- Epoch 11/100 ---

Train: 100%|██████████| 4666/4666 [04:58<00:00, 15.63it/s]
2025-11-23 00:27:41,473 - INFO - Epoch 11 Train - Loss: 0.0578, Accuracy: 0.9769, Precision: 0.9449, Recall: 0.9707

Val  : 100%|██████████| 727/727 [00:34<00:00, 21.11it/s]
2025-11-23 00:28:15,915 - INFO - Epoch 11 Val   - Loss: 1.7462, Accuracy: 0.7391, Precision: 0.6499, Recall: 0.7012
2025-11-23 00:28:15,915 - INFO - 
--- Epoch 12/100 ---

Train: 100%|██████████| 4666/4666 [04:59<00:00, 15.59it/s]
2025-11-23 00:33:15,156 - INFO - Epoch 12 Train - Loss: 0.0567, Accuracy: 0.9774, Precision: 0.9459, Recall: 0.9711

Val  : 100%|██████████| 727/727 [00:34<00:00, 20.97it/s]
2025-11-23 00:33:49,822 - INFO - Epoch 12 Val   - Loss: 1.8007, Accuracy: 0.7418, Precision: 0.6458, Recall: 0.7025
2025-11-23 00:33:49,822 - INFO - 
--- Epoch 13/100 ---

Train: 100%|██████████| 4666/4666 [04:56<00:00, 15.73it/s]
2025-11-23 00:38:46,438 - INFO - Epoch 13 Train - Loss: 0.0558, Accuracy: 0.9777, Precision: 0.9466, Recall: 0.9714

Val  : 100%|██████████| 727/727 [00:34<00:00, 21.01it/s]
2025-11-23 00:39:21,045 - INFO - Epoch 13 Val   - Loss: 1.6797, Accuracy: 0.7456, Precision: 0.6437, Recall: 0.7087
2025-11-23 00:39:21,045 - INFO - 
--- Epoch 14/100 ---

Train: 100%|██████████| 4666/4666 [04:57<00:00, 15.70it/s]
2025-11-23 00:44:18,228 - INFO - Epoch 14 Train - Loss: 0.0549, Accuracy: 0.9781, Precision: 0.9475, Recall: 0.9718

Val  : 100%|██████████| 727/727 [00:34<00:00, 20.91it/s]
2025-11-23 00:44:52,998 - INFO - Epoch 14 Val   - Loss: 1.8171, Accuracy: 0.7395, Precision: 0.6509, Recall: 0.7042
2025-11-23 00:44:52,999 - INFO - 
--- Epoch 15/100 ---

Train: 100%|██████████| 4666/4666 [04:59<00:00, 15.60it/s]
2025-11-23 00:49:52,093 - INFO - Epoch 15 Train - Loss: 0.0541, Accuracy: 0.9785, Precision: 0.9482, Recall: 0.9721

Val  : 100%|██████████| 727/727 [00:35<00:00, 20.49it/s]
2025-11-23 00:50:27,572 - INFO - Epoch 15 Val   - Loss: 1.7165, Accuracy: 0.7509, Precision: 0.6530, Recall: 0.7247
2025-11-23 00:50:27,573 - INFO - 
--- Epoch 16/100 ---

Train: 100%|██████████| 4666/4666 [05:00<00:00, 15.54it/s]
2025-11-23 00:55:27,802 - INFO - Epoch 16 Train - Loss: 0.0534, Accuracy: 0.9788, Precision: 0.9489, Recall: 0.9724

Val  : 100%|██████████| 727/727 [00:35<00:00, 20.70it/s]
2025-11-23 00:56:02,932 - INFO - Epoch 16 Val   - Loss: 1.8262, Accuracy: 0.7448, Precision: 0.6530, Recall: 0.7038
2025-11-23 00:56:02,933 - INFO - 
--- Epoch 17/100 ---

Train: 100%|██████████| 4666/4666 [04:57<00:00, 15.66it/s]
2025-11-23 01:01:00,804 - INFO - Epoch 17 Train - Loss: 0.0527, Accuracy: 0.9791, Precision: 0.9496, Recall: 0.9727

Val  : 100%|██████████| 727/727 [00:34<00:00, 21.20it/s]
2025-11-23 01:01:35,101 - INFO - Epoch 17 Val   - Loss: 1.7425, Accuracy: 0.7518, Precision: 0.6572, Recall: 0.7158
2025-11-23 01:01:35,102 - INFO - 
--- Epoch 18/100 ---

Train: 100%|██████████| 4666/4666 [04:56<00:00, 15.76it/s]
2025-11-23 01:06:31,201 - INFO - Epoch 18 Train - Loss: 0.0520, Accuracy: 0.9794, Precision: 0.9501, Recall: 0.9730

Val  : 100%|██████████| 727/727 [00:34<00:00, 21.14it/s]
2025-11-23 01:07:05,595 - INFO - Epoch 18 Val   - Loss: 1.9202, Accuracy: 0.7428, Precision: 0.6525, Recall: 0.7088
2025-11-23 01:07:05,595 - INFO - 
--- Epoch 19/100 ---

Train: 100%|██████████| 4666/4666 [04:57<00:00, 15.69it/s]
2025-11-23 01:12:02,945 - INFO - Epoch 19 Train - Loss: 0.0515, Accuracy: 0.9796, Precision: 0.9507, Recall: 0.9732

Val  : 100%|██████████| 727/727 [00:34<00:00, 21.08it/s]
2025-11-23 01:12:37,436 - INFO - Epoch 19 Val   - Loss: 1.8262, Accuracy: 0.7514, Precision: 0.6597, Recall: 0.7220
2025-11-23 01:12:37,436 - INFO - 
--- Epoch 20/100 ---

Train: 100%|██████████| 4666/4666 [04:58<00:00, 15.64it/s]
2025-11-23 01:17:35,681 - INFO - Epoch 20 Train - Loss: 0.0508, Accuracy: 0.9799, Precision: 0.9512, Recall: 0.9735

Val  : 100%|██████████| 727/727 [00:35<00:00, 20.43it/s]
2025-11-23 01:18:11,275 - INFO - Epoch 20 Val   - Loss: 1.8107, Accuracy: 0.7488, Precision: 0.6514, Recall: 0.7132
2025-11-23 01:18:11,275 - INFO - 
--- Epoch 21/100 ---

Train: 100%|██████████| 4666/4666 [05:00<00:00, 15.52it/s]
2025-11-23 01:23:11,933 - INFO - Epoch 21 Train - Loss: 0.0503, Accuracy: 0.9801, Precision: 0.9518, Recall: 0.9737

Val  : 100%|██████████| 727/727 [00:35<00:00, 20.75it/s]
2025-11-23 01:23:46,967 - INFO - Epoch 21 Val   - Loss: 1.9406, Accuracy: 0.7377, Precision: 0.6455, Recall: 0.6988
2025-11-23 01:23:46,967 - INFO - 
--- Epoch 22/100 ---

Train: 100%|██████████| 4666/4666 [05:00<00:00, 15.51it/s]
2025-11-23 01:28:47,738 - INFO - Epoch 22 Train - Loss: 0.0498, Accuracy: 0.9803, Precision: 0.9522, Recall: 0.9739

Val  : 100%|██████████| 727/727 [00:34<00:00, 20.97it/s]
2025-11-23 01:29:22,411 - INFO - Epoch 22 Val   - Loss: 1.9190, Accuracy: 0.7423, Precision: 0.6520, Recall: 0.6926
2025-11-23 01:29:22,411 - INFO - 
--- Epoch 23/100 ---

Train: 100%|██████████| 4666/4666 [04:59<00:00, 15.56it/s]
2025-11-23 01:34:22,312 - INFO - Epoch 23 Train - Loss: 0.0493, Accuracy: 0.9805, Precision: 0.9526, Recall: 0.9741

Val  : 100%|██████████| 727/727 [00:34<00:00, 20.92it/s]
2025-11-23 01:34:57,067 - INFO - Epoch 23 Val   - Loss: 2.0626, Accuracy: 0.7374, Precision: 0.6548, Recall: 0.6925
2025-11-23 01:34:57,067 - INFO - 
--- Epoch 24/100 ---

Train: 100%|██████████| 4666/4666 [04:59<00:00, 15.58it/s]
2025-11-23 01:39:56,565 - INFO - Epoch 24 Train - Loss: 0.0489, Accuracy: 0.9807, Precision: 0.9531, Recall: 0.9743

Val  : 100%|██████████| 727/727 [00:35<00:00, 20.66it/s]
2025-11-23 01:40:31,763 - INFO - Epoch 24 Val   - Loss: 2.0120, Accuracy: 0.7396, Precision: 0.6485, Recall: 0.7027
2025-11-23 01:40:31,764 - INFO - 
--- Epoch 25/100 ---

Train: 100%|██████████| 4666/4666 [05:01<00:00, 15.49it/s]
2025-11-23 01:45:32,898 - INFO - Epoch 25 Train - Loss: 0.0484, Accuracy: 0.9809, Precision: 0.9535, Recall: 0.9745

Val  : 100%|██████████| 727/727 [00:35<00:00, 20.68it/s]
2025-11-23 01:46:08,052 - INFO - Epoch 25 Val   - Loss: 2.0756, Accuracy: 0.7380, Precision: 0.6567, Recall: 0.6959
2025-11-23 01:46:08,052 - INFO - 
--- Epoch 26/100 ---

Train: 100%|██████████| 4666/4666 [04:58<00:00, 15.62it/s]
2025-11-23 01:51:06,720 - INFO - Epoch 26 Train - Loss: 0.0480, Accuracy: 0.9811, Precision: 0.9539, Recall: 0.9746

Val  : 100%|██████████| 727/727 [00:34<00:00, 20.95it/s]
2025-11-23 01:51:41,423 - INFO - Epoch 26 Val   - Loss: 1.9529, Accuracy: 0.7431, Precision: 0.6535, Recall: 0.7143
2025-11-23 01:51:41,423 - INFO - 
--- Epoch 27/100 ---

Train: 100%|██████████| 4666/4666 [04:58<00:00, 15.62it/s]
2025-11-23 01:56:40,200 - INFO - Epoch 27 Train - Loss: 0.0477, Accuracy: 0.9812, Precision: 0.9542, Recall: 0.9748

Val  : 100%|██████████| 727/727 [00:34<00:00, 20.99it/s]
2025-11-23 01:57:14,830 - INFO - Epoch 27 Val   - Loss: 1.9511, Accuracy: 0.7417, Precision: 0.6470, Recall: 0.7079
2025-11-23 01:57:14,830 - INFO - 
--- Epoch 28/100 ---

Train: 100%|██████████| 4666/4666 [05:02<00:00, 15.41it/s]
2025-11-23 02:02:17,635 - INFO - Epoch 28 Train - Loss: 0.0472, Accuracy: 0.9814, Precision: 0.9546, Recall: 0.9750

Val  : 100%|██████████| 727/727 [00:35<00:00, 20.56it/s]
2025-11-23 02:02:53,003 - INFO - Epoch 28 Val   - Loss: 2.0412, Accuracy: 0.7420, Precision: 0.6528, Recall: 0.7028
2025-11-23 02:02:53,003 - INFO - 
--- Epoch 29/100 ---

Train: 100%|██████████| 4666/4666 [05:03<00:00, 15.39it/s]
2025-11-23 02:07:56,246 - INFO - Epoch 29 Train - Loss: 0.0469, Accuracy: 0.9815, Precision: 0.9550, Recall: 0.9751

Val  : 100%|██████████| 727/727 [00:34<00:00, 20.96it/s]
2025-11-23 02:08:30,939 - INFO - Epoch 29 Val   - Loss: 2.0565, Accuracy: 0.7398, Precision: 0.6497, Recall: 0.6988
2025-11-23 02:08:30,939 - INFO - 
--- Epoch 30/100 ---

Train: 100%|██████████| 4666/4666 [04:57<00:00, 15.70it/s]
2025-11-23 02:13:28,137 - INFO - Epoch 30 Train - Loss: 0.0466, Accuracy: 0.9816, Precision: 0.9552, Recall: 0.9753

Val  : 100%|██████████| 727/727 [00:34<00:00, 20.94it/s]
2025-11-23 02:14:02,864 - INFO - Epoch 30 Val   - Loss: 1.9311, Accuracy: 0.7417, Precision: 0.6458, Recall: 0.7048
2025-11-23 02:14:02,864 - INFO - 
--- Epoch 31/100 ---

Train: 100%|██████████| 4666/4666 [04:57<00:00, 15.68it/s]
2025-11-23 02:19:00,404 - INFO - Epoch 31 Train - Loss: 0.0462, Accuracy: 0.9818, Precision: 0.9555, Recall: 0.9754

Val  : 100%|██████████| 727/727 [00:34<00:00, 20.81it/s]
2025-11-23 02:19:35,333 - INFO - Epoch 31 Val   - Loss: 2.0314, Accuracy: 0.7350, Precision: 0.6403, Recall: 0.7012
2025-11-23 02:19:35,333 - INFO - 
--- Epoch 32/100 ---

Train: 100%|██████████| 4666/4666 [05:01<00:00, 15.48it/s]
2025-11-23 02:24:36,745 - INFO - Epoch 32 Train - Loss: 0.0459, Accuracy: 0.9819, Precision: 0.9559, Recall: 0.9756

Val  : 100%|██████████| 727/727 [00:35<00:00, 20.58it/s]
2025-11-23 02:25:12,076 - INFO - Epoch 32 Val   - Loss: 2.1829, Accuracy: 0.7329, Precision: 0.6437, Recall: 0.6856
2025-11-23 02:25:12,076 - INFO - 
--- Epoch 33/100 ---

Train: 100%|██████████| 4666/4666 [05:00<00:00, 15.53it/s]
2025-11-23 02:30:12,483 - INFO - Epoch 33 Train - Loss: 0.0456, Accuracy: 0.9820, Precision: 0.9561, Recall: 0.9757

Val  : 100%|██████████| 727/727 [00:34<00:00, 20.98it/s]
2025-11-23 02:30:47,138 - INFO - Epoch 33 Val   - Loss: 2.1909, Accuracy: 0.7324, Precision: 0.6420, Recall: 0.6840
2025-11-23 02:30:47,138 - INFO - 
--- Epoch 34/100 ---

Train: 100%|██████████| 4666/4666 [04:57<00:00, 15.66it/s]
2025-11-23 02:35:45,043 - INFO - Epoch 34 Train - Loss: 0.0453, Accuracy: 0.9822, Precision: 0.9564, Recall: 0.9758

Val  : 100%|██████████| 727/727 [00:34<00:00, 20.86it/s]
2025-11-23 02:36:19,888 - INFO - Epoch 34 Val   - Loss: 2.0929, Accuracy: 0.7387, Precision: 0.6437, Recall: 0.6897
2025-11-23 02:36:19,888 - INFO - 
--- Epoch 35/100 ---

Train: 100%|██████████| 4666/4666 [04:58<00:00, 15.62it/s]
2025-11-23 02:41:18,641 - INFO - Epoch 35 Train - Loss: 0.0450, Accuracy: 0.9823, Precision: 0.9566, Recall: 0.9760

Val  : 100%|██████████| 727/727 [00:35<00:00, 20.65it/s]
2025-11-23 02:41:53,846 - INFO - Epoch 35 Val   - Loss: 2.1473, Accuracy: 0.7318, Precision: 0.6385, Recall: 0.6965
2025-11-23 02:41:53,846 - INFO - 
--- Epoch 36/100 ---

Train: 100%|██████████| 4666/4666 [05:01<00:00, 15.46it/s]
2025-11-23 02:46:55,654 - INFO - Epoch 36 Train - Loss: 0.0447, Accuracy: 0.9824, Precision: 0.9569, Recall: 0.9761

Val  : 100%|██████████| 727/727 [00:35<00:00, 20.64it/s]
2025-11-23 02:47:30,887 - INFO - Epoch 36 Val   - Loss: 2.1530, Accuracy: 0.7336, Precision: 0.6397, Recall: 0.6873
2025-11-23 02:47:30,887 - INFO - 
--- Epoch 37/100 ---

Train: 100%|██████████| 4666/4666 [04:59<00:00, 15.56it/s]
2025-11-23 02:52:30,762 - INFO - Epoch 37 Train - Loss: 0.0445, Accuracy: 0.9825, Precision: 0.9572, Recall: 0.9762

Val  : 100%|██████████| 727/727 [00:34<00:00, 20.89it/s]
2025-11-23 02:53:05,568 - INFO - Epoch 37 Val   - Loss: 2.0176, Accuracy: 0.7414, Precision: 0.6507, Recall: 0.7038
2025-11-23 02:53:05,568 - INFO - 
--- Epoch 38/100 ---

Train: 100%|██████████| 4666/4666 [04:59<00:00, 15.59it/s]
2025-11-23 02:58:04,788 - INFO - Epoch 38 Train - Loss: 0.0442, Accuracy: 0.9826, Precision: 0.9574, Recall: 0.9763

Val  : 100%|██████████| 727/727 [00:34<00:00, 20.97it/s]
2025-11-23 02:58:39,461 - INFO - Epoch 38 Val   - Loss: 2.0514, Accuracy: 0.7432, Precision: 0.6503, Recall: 0.6984
2025-11-23 02:58:39,461 - INFO - 
--- Epoch 39/100 ---

Train: 100%|██████████| 4666/4666 [05:00<00:00, 15.55it/s]
2025-11-23 03:03:39,612 - INFO - Epoch 39 Train - Loss: 0.0440, Accuracy: 0.9827, Precision: 0.9576, Recall: 0.9764

Val  : 100%|██████████| 727/727 [00:35<00:00, 20.58it/s]
2025-11-23 03:04:14,945 - INFO - Epoch 39 Val   - Loss: 2.1770, Accuracy: 0.7379, Precision: 0.6531, Recall: 0.6980
2025-11-23 03:04:14,945 - INFO - 
--- Epoch 40/100 ---

Train: 100%|██████████| 4666/4666 [05:01<00:00, 15.49it/s]
2025-11-23 03:09:16,240 - INFO - Epoch 40 Train - Loss: 0.0438, Accuracy: 0.9828, Precision: 0.9578, Recall: 0.9765

Val  : 100%|██████████| 727/727 [00:35<00:00, 20.66it/s]
2025-11-23 03:09:51,431 - INFO - Epoch 40 Val   - Loss: 2.1527, Accuracy: 0.7339, Precision: 0.6432, Recall: 0.6878
2025-11-23 03:09:51,431 - INFO - 
--- Epoch 41/100 ---

Train: 100%|██████████| 4666/4666 [05:01<00:00, 15.49it/s]
2025-11-23 03:14:52,709 - INFO - Epoch 41 Train - Loss: 0.0435, Accuracy: 0.9829, Precision: 0.9581, Recall: 0.9766

Val  : 100%|██████████| 727/727 [00:34<00:00, 20.87it/s]
2025-11-23 03:15:27,550 - INFO - Epoch 41 Val   - Loss: 2.2115, Accuracy: 0.7380, Precision: 0.6481, Recall: 0.6933
2025-11-23 03:15:27,550 - INFO - 
--- Epoch 42/100 ---

Train: 100%|██████████| 4666/4666 [04:57<00:00, 15.67it/s]
2025-11-23 03:20:25,391 - INFO - Epoch 42 Train - Loss: 0.0433, Accuracy: 0.9830, Precision: 0.9582, Recall: 0.9767

Val  : 100%|██████████| 727/727 [00:34<00:00, 21.01it/s]
2025-11-23 03:20:59,996 - INFO - Epoch 42 Val   - Loss: 2.1328, Accuracy: 0.7382, Precision: 0.6408, Recall: 0.6939
2025-11-23 03:20:59,996 - INFO - 
--- Epoch 43/100 ---

Train: 100%|██████████| 4666/4666 [05:01<00:00, 15.49it/s]
2025-11-23 03:26:01,274 - INFO - Epoch 43 Train - Loss: 0.0431, Accuracy: 0.9830, Precision: 0.9585, Recall: 0.9768

Val  : 100%|██████████| 727/727 [00:35<00:00, 20.62it/s]
2025-11-23 03:26:36,527 - INFO - Epoch 43 Val   - Loss: 2.2399, Accuracy: 0.7315, Precision: 0.6423, Recall: 0.6823
2025-11-23 03:26:36,527 - INFO - 
--- Epoch 44/100 ---

Train: 100%|██████████| 4666/4666 [05:02<00:00, 15.43it/s]
2025-11-23 03:31:38,981 - INFO - Epoch 44 Train - Loss: 0.0429, Accuracy: 0.9831, Precision: 0.9587, Recall: 0.9769

Val  : 100%|██████████| 727/727 [00:35<00:00, 20.59it/s]
2025-11-23 03:32:14,298 - INFO - Epoch 44 Val   - Loss: 2.2406, Accuracy: 0.7363, Precision: 0.6493, Recall: 0.6911
2025-11-23 03:32:14,298 - INFO - 
--- Epoch 45/100 ---

Train: 100%|██████████| 4666/4666 [04:59<00:00, 15.56it/s]
2025-11-23 03:37:14,139 - INFO - Epoch 45 Train - Loss: 0.0427, Accuracy: 0.9832, Precision: 0.9588, Recall: 0.9770

Val  : 100%|██████████| 727/727 [00:34<00:00, 20.98it/s]
2025-11-23 03:37:48,786 - INFO - Epoch 45 Val   - Loss: 2.1596, Accuracy: 0.7411, Precision: 0.6509, Recall: 0.7009
2025-11-23 03:37:48,787 - INFO - 
--- Epoch 46/100 ---

Train: 100%|██████████| 4666/4666 [04:57<00:00, 15.71it/s]
2025-11-23 03:42:45,801 - INFO - Epoch 46 Train - Loss: 0.0425, Accuracy: 0.9833, Precision: 0.9591, Recall: 0.9771

Val  : 100%|██████████| 727/727 [00:34<00:00, 21.01it/s]
2025-11-23 03:43:20,400 - INFO - Epoch 46 Val   - Loss: 2.2377, Accuracy: 0.7322, Precision: 0.6459, Recall: 0.6833
2025-11-23 03:43:20,400 - INFO - 
--- Epoch 47/100 ---

Train: 100%|██████████| 4666/4666 [04:58<00:00, 15.64it/s]
2025-11-23 03:48:18,733 - INFO - Epoch 47 Train - Loss: 0.0423, Accuracy: 0.9834, Precision: 0.9592, Recall: 0.9772

Val  : 100%|██████████| 727/727 [00:35<00:00, 20.62it/s]
2025-11-23 03:48:53,992 - INFO - Epoch 47 Val   - Loss: 2.2312, Accuracy: 0.7341, Precision: 0.6428, Recall: 0.6888
2025-11-23 03:48:53,992 - INFO - 
--- Epoch 48/100 ---

Train: 100%|██████████| 4666/4666 [05:02<00:00, 15.43it/s]
2025-11-23 03:53:56,481 - INFO - Epoch 48 Train - Loss: 0.0421, Accuracy: 0.9835, Precision: 0.9594, Recall: 0.9773

Val  : 100%|██████████| 727/727 [00:35<00:00, 20.60it/s]
2025-11-23 03:54:31,766 - INFO - Epoch 48 Val   - Loss: 2.1753, Accuracy: 0.7410, Precision: 0.6538, Recall: 0.6967
2025-11-23 03:54:31,766 - INFO - 
--- Epoch 49/100 ---

Train: 100%|██████████| 4666/4666 [05:00<00:00, 15.55it/s]
2025-11-23 03:59:31,846 - INFO - Epoch 49 Train - Loss: 0.0419, Accuracy: 0.9835, Precision: 0.9596, Recall: 0.9774

Val  : 100%|██████████| 727/727 [00:34<00:00, 20.93it/s]
2025-11-23 04:00:06,590 - INFO - Epoch 49 Val   - Loss: 2.2189, Accuracy: 0.7368, Precision: 0.6480, Recall: 0.6916
2025-11-23 04:00:06,591 - INFO - 
--- Epoch 50/100 ---

Train: 100%|██████████| 4666/4666 [04:57<00:00, 15.68it/s]
2025-11-23 04:05:04,191 - INFO - Epoch 50 Train - Loss: 0.0417, Accuracy: 0.9836, Precision: 0.9598, Recall: 0.9774

Val  : 100%|██████████| 727/727 [00:34<00:00, 20.96it/s]
2025-11-23 04:05:38,884 - INFO - Epoch 50 Val   - Loss: 2.2179, Accuracy: 0.7377, Precision: 0.6455, Recall: 0.6899
2025-11-23 04:05:38,885 - INFO - 
--- Epoch 51/100 ---

Train: 100%|██████████| 4666/4666 [04:59<00:00, 15.60it/s]
2025-11-23 04:10:38,067 - INFO - Epoch 51 Train - Loss: 0.0416, Accuracy: 0.9837, Precision: 0.9599, Recall: 0.9775

Val  : 100%|██████████| 727/727 [00:35<00:00, 20.63it/s]
2025-11-23 04:11:13,307 - INFO - Epoch 51 Val   - Loss: 2.3745, Accuracy: 0.7307, Precision: 0.6445, Recall: 0.6741
2025-11-23 04:11:13,307 - INFO - 
--- Epoch 52/100 ---

Train: 100%|██████████| 4666/4666 [05:01<00:00, 15.50it/s]
2025-11-23 04:16:14,367 - INFO - Epoch 52 Train - Loss: 0.0414, Accuracy: 0.9838, Precision: 0.9601, Recall: 0.9776

Val  : 100%|██████████| 727/727 [00:34<00:00, 21.00it/s]
2025-11-23 04:16:48,996 - INFO - Epoch 52 Val   - Loss: 2.2934, Accuracy: 0.7369, Precision: 0.6479, Recall: 0.6895
2025-11-23 04:16:48,996 - INFO - 
--- Epoch 53/100 ---

Train: 100%|██████████| 4666/4666 [04:57<00:00, 15.69it/s]
2025-11-23 04:21:46,416 - INFO - Epoch 53 Train - Loss: 0.0412, Accuracy: 0.9838, Precision: 0.9603, Recall: 0.9777

Val  : 100%|██████████| 727/727 [00:34<00:00, 20.95it/s]
2025-11-23 04:22:21,125 - INFO - Epoch 53 Val   - Loss: 2.3706, Accuracy: 0.7347, Precision: 0.6469, Recall: 0.6900
2025-11-23 04:22:21,126 - INFO - 
--- Epoch 54/100 ---

Train: 100%|██████████| 4666/4666 [04:59<00:00, 15.60it/s]
2025-11-23 04:27:20,154 - INFO - Epoch 54 Train - Loss: 0.0411, Accuracy: 0.9839, Precision: 0.9605, Recall: 0.9777

Val  : 100%|██████████| 727/727 [00:34<00:00, 20.99it/s]
2025-11-23 04:27:54,789 - INFO - Epoch 54 Val   - Loss: 2.2896, Accuracy: 0.7341, Precision: 0.6401, Recall: 0.6972
2025-11-23 04:27:54,789 - INFO - 
--- Epoch 55/100 ---

Train: 100%|██████████| 4666/4666 [05:02<00:00, 15.43it/s]
2025-11-23 04:32:57,202 - INFO - Epoch 55 Train - Loss: 0.0409, Accuracy: 0.9840, Precision: 0.9606, Recall: 0.9778

Val  : 100%|██████████| 727/727 [00:35<00:00, 20.71it/s]
2025-11-23 04:33:32,314 - INFO - Epoch 55 Val   - Loss: 2.2153, Accuracy: 0.7420, Precision: 0.6489, Recall: 0.6987
2025-11-23 04:33:32,314 - INFO - 
--- Epoch 56/100 ---

Train: 100%|██████████| 4666/4666 [04:59<00:00, 15.57it/s]
2025-11-23 04:38:31,930 - INFO - Epoch 56 Train - Loss: 0.0408, Accuracy: 0.9840, Precision: 0.9607, Recall: 0.9779

Val  : 100%|██████████| 727/727 [00:34<00:00, 20.98it/s]
2025-11-23 04:39:06,589 - INFO - Epoch 56 Val   - Loss: 2.2935, Accuracy: 0.7354, Precision: 0.6422, Recall: 0.6905
2025-11-23 04:39:06,590 - INFO - 
--- Epoch 57/100 ---

Train: 100%|██████████| 4666/4666 [04:57<00:00, 15.70it/s]
2025-11-23 04:44:03,804 - INFO - Epoch 57 Train - Loss: 0.0407, Accuracy: 0.9841, Precision: 0.9608, Recall: 0.9779

Val  : 100%|██████████| 727/727 [00:34<00:00, 20.96it/s]
2025-11-23 04:44:38,492 - INFO - Epoch 57 Val   - Loss: 2.2689, Accuracy: 0.7340, Precision: 0.6434, Recall: 0.6884
2025-11-23 04:44:38,492 - INFO - 
--- Epoch 58/100 ---

Train: 100%|██████████| 4666/4666 [04:58<00:00, 15.61it/s]
2025-11-23 04:49:37,424 - INFO - Epoch 58 Train - Loss: 0.0405, Accuracy: 0.9841, Precision: 0.9610, Recall: 0.9780

Val  : 100%|██████████| 727/727 [00:35<00:00, 20.56it/s]
2025-11-23 04:50:12,778 - INFO - Epoch 58 Val   - Loss: 2.2284, Accuracy: 0.7398, Precision: 0.6486, Recall: 0.6923
2025-11-23 04:50:12,778 - INFO - 
--- Epoch 59/100 ---

Train: 100%|██████████| 4666/4666 [05:01<00:00, 15.47it/s]
2025-11-23 04:55:14,439 - INFO - Epoch 59 Train - Loss: 0.0403, Accuracy: 0.9842, Precision: 0.9611, Recall: 0.9781

Val  : 100%|██████████| 727/727 [00:35<00:00, 20.63it/s]
2025-11-23 04:55:49,683 - INFO - Epoch 59 Val   - Loss: 2.2629, Accuracy: 0.7399, Precision: 0.6458, Recall: 0.6925
2025-11-23 04:55:49,683 - INFO - 
--- Epoch 60/100 ---

Train: 100%|██████████| 4666/4666 [05:01<00:00, 15.49it/s]
2025-11-23 05:00:50,864 - INFO - Epoch 60 Train - Loss: 0.0402, Accuracy: 0.9842, Precision: 0.9613, Recall: 0.9781

Val  : 100%|██████████| 727/727 [00:34<00:00, 20.99it/s]
2025-11-23 05:01:25,506 - INFO - Epoch 60 Val   - Loss: 2.3443, Accuracy: 0.7405, Precision: 0.6504, Recall: 0.6885
2025-11-23 05:01:25,506 - INFO - 
--- Epoch 61/100 ---

Train: 100%|██████████| 4666/4666 [04:59<00:00, 15.59it/s]
2025-11-23 05:06:24,749 - INFO - Epoch 61 Train - Loss: 0.0401, Accuracy: 0.9843, Precision: 0.9614, Recall: 0.9782

Val  : 100%|██████████| 727/727 [00:34<00:00, 20.99it/s]
2025-11-23 05:06:59,384 - INFO - Epoch 61 Val   - Loss: 2.3603, Accuracy: 0.7337, Precision: 0.6444, Recall: 0.6787
2025-11-23 05:06:59,384 - INFO - 
--- Epoch 62/100 ---

Train: 100%|██████████| 4666/4666 [04:59<00:00, 15.58it/s]
2025-11-23 05:11:58,824 - INFO - Epoch 62 Train - Loss: 0.0399, Accuracy: 0.9844, Precision: 0.9616, Recall: 0.9783

Val  : 100%|██████████| 727/727 [00:35<00:00, 20.68it/s]
2025-11-23 05:12:33,979 - INFO - Epoch 62 Val   - Loss: 2.3193, Accuracy: 0.7370, Precision: 0.6438, Recall: 0.6865
2025-11-23 05:12:33,979 - INFO - 
--- Epoch 63/100 ---

Train: 100%|██████████| 4666/4666 [05:03<00:00, 15.37it/s]
2025-11-23 05:17:37,467 - INFO - Epoch 63 Train - Loss: 0.0398, Accuracy: 0.9844, Precision: 0.9617, Recall: 0.9783

Val  : 100%|██████████| 727/727 [00:35<00:00, 20.68it/s]
2025-11-23 05:18:12,630 - INFO - Epoch 63 Val   - Loss: 2.2773, Accuracy: 0.7401, Precision: 0.6484, Recall: 0.6930
2025-11-23 05:18:12,630 - INFO - 
--- Epoch 64/100 ---

Train: 100%|██████████| 4666/4666 [04:59<00:00, 15.60it/s]
2025-11-23 05:23:11,694 - INFO - Epoch 64 Train - Loss: 0.0396, Accuracy: 0.9845, Precision: 0.9618, Recall: 0.9784

Val  : 100%|██████████| 727/727 [00:34<00:00, 21.02it/s]
2025-11-23 05:23:46,282 - INFO - Epoch 64 Val   - Loss: 2.3358, Accuracy: 0.7356, Precision: 0.6427, Recall: 0.6860
2025-11-23 05:23:46,283 - INFO - 
--- Epoch 65/100 ---

Train: 100%|██████████| 4666/4666 [04:57<00:00, 15.70it/s]
2025-11-23 05:28:43,396 - INFO - Epoch 65 Train - Loss: 0.0395, Accuracy: 0.9845, Precision: 0.9619, Recall: 0.9785

Val  : 100%|██████████| 727/727 [00:34<00:00, 20.99it/s]
2025-11-23 05:29:18,038 - INFO - Epoch 65 Val   - Loss: 2.3663, Accuracy: 0.7347, Precision: 0.6427, Recall: 0.6823
2025-11-23 05:29:18,038 - INFO - 
--- Epoch 66/100 ---

Train: 100%|██████████| 4666/4666 [04:59<00:00, 15.58it/s]
2025-11-23 05:34:17,505 - INFO - Epoch 66 Train - Loss: 0.0394, Accuracy: 0.9846, Precision: 0.9621, Recall: 0.9785

Val  : 100%|██████████| 727/727 [00:35<00:00, 20.63it/s]
2025-11-23 05:34:52,749 - INFO - Epoch 66 Val   - Loss: 2.2968, Accuracy: 0.7376, Precision: 0.6455, Recall: 0.6880
2025-11-23 05:34:52,749 - INFO - 
--- Epoch 67/100 ---

Train: 100%|██████████| 4666/4666 [05:00<00:00, 15.52it/s]
2025-11-23 05:39:53,489 - INFO - Epoch 67 Train - Loss: 0.0393, Accuracy: 0.9846, Precision: 0.9622, Recall: 0.9786

Val  : 100%|██████████| 727/727 [00:35<00:00, 20.60it/s]
2025-11-23 05:40:28,783 - INFO - Epoch 67 Val   - Loss: 2.3622, Accuracy: 0.7343, Precision: 0.6466, Recall: 0.6814
2025-11-23 05:40:28,783 - INFO - 
--- Epoch 68/100 ---

Train: 100%|██████████| 4666/4666 [04:59<00:00, 15.58it/s]
2025-11-23 05:45:28,278 - INFO - Epoch 68 Train - Loss: 0.0392, Accuracy: 0.9847, Precision: 0.9623, Recall: 0.9786

Val  : 100%|██████████| 727/727 [00:34<00:00, 20.92it/s]
2025-11-23 05:46:03,026 - INFO - Epoch 68 Val   - Loss: 2.3791, Accuracy: 0.7396, Precision: 0.6511, Recall: 0.6903
2025-11-23 05:46:03,026 - INFO - 
--- Epoch 69/100 ---

Train: 100%|██████████| 4666/4666 [04:58<00:00, 15.64it/s]
2025-11-23 05:51:01,399 - INFO - Epoch 69 Train - Loss: 0.0391, Accuracy: 0.9847, Precision: 0.9624, Recall: 0.9787

Val  : 100%|██████████| 727/727 [00:34<00:00, 20.90it/s]
2025-11-23 05:51:36,186 - INFO - Epoch 69 Val   - Loss: 2.4360, Accuracy: 0.7313, Precision: 0.6418, Recall: 0.6813
2025-11-23 05:51:36,186 - INFO - 
--- Epoch 70/100 ---

Train: 100%|██████████| 4666/4666 [04:59<00:00, 15.57it/s]
2025-11-23 05:56:35,912 - INFO - Epoch 70 Train - Loss: 0.0389, Accuracy: 0.9848, Precision: 0.9625, Recall: 0.9787

Val  : 100%|██████████| 727/727 [00:35<00:00, 20.64it/s]
2025-11-23 05:57:11,144 - INFO - Epoch 70 Val   - Loss: 2.4246, Accuracy: 0.7347, Precision: 0.6445, Recall: 0.6709
2025-11-23 05:57:11,144 - INFO - 
--- Epoch 71/100 ---

Train: 100%|██████████| 4666/4666 [05:01<00:00, 15.48it/s]
2025-11-23 06:02:12,488 - INFO - Epoch 71 Train - Loss: 0.0388, Accuracy: 0.9848, Precision: 0.9627, Recall: 0.9788

Val  : 100%|██████████| 727/727 [00:35<00:00, 20.49it/s]
2025-11-23 06:02:47,971 - INFO - Epoch 71 Val   - Loss: 2.4205, Accuracy: 0.7352, Precision: 0.6450, Recall: 0.6810
2025-11-23 06:02:47,971 - INFO - 
--- Epoch 72/100 ---

Train: 100%|██████████| 4666/4666 [04:57<00:00, 15.68it/s]
2025-11-23 06:07:45,600 - INFO - Epoch 72 Train - Loss: 0.0387, Accuracy: 0.9849, Precision: 0.9627, Recall: 0.9788

Val  : 100%|██████████| 727/727 [00:34<00:00, 20.82it/s]
2025-11-23 06:08:20,518 - INFO - Epoch 72 Val   - Loss: 2.4121, Accuracy: 0.7370, Precision: 0.6417, Recall: 0.6895
2025-11-23 06:08:20,518 - INFO - 
--- Epoch 73/100 ---

Train: 100%|██████████| 4666/4666 [05:00<00:00, 15.55it/s]
2025-11-23 06:13:20,621 - INFO - Epoch 73 Train - Loss: 0.0386, Accuracy: 0.9849, Precision: 0.9628, Recall: 0.9789

Val  : 100%|██████████| 727/727 [00:34<00:00, 20.91it/s]
2025-11-23 06:13:55,389 - INFO - Epoch 73 Val   - Loss: 2.3521, Accuracy: 0.7366, Precision: 0.6429, Recall: 0.6758
2025-11-23 06:13:55,389 - INFO - 
--- Epoch 74/100 ---

Train: 100%|██████████| 4666/4666 [05:01<00:00, 15.49it/s]
2025-11-23 06:18:56,594 - INFO - Epoch 74 Train - Loss: 0.0385, Accuracy: 0.9849, Precision: 0.9629, Recall: 0.9789

Val  : 100%|██████████| 727/727 [00:35<00:00, 20.61it/s]
2025-11-23 06:19:31,873 - INFO - Epoch 74 Val   - Loss: 2.4657, Accuracy: 0.7343, Precision: 0.6419, Recall: 0.6792
2025-11-23 06:19:31,873 - INFO - 
--- Epoch 75/100 ---

Train: 100%|██████████| 4666/4666 [05:00<00:00, 15.53it/s]
2025-11-23 06:24:32,294 - INFO - Epoch 75 Train - Loss: 0.0384, Accuracy: 0.9850, Precision: 0.9631, Recall: 0.9790

Val  : 100%|██████████| 727/727 [00:34<00:00, 20.85it/s]
2025-11-23 06:25:07,163 - INFO - Epoch 75 Val   - Loss: 2.4028, Accuracy: 0.7382, Precision: 0.6437, Recall: 0.6820
2025-11-23 06:25:07,163 - INFO - 
--- Epoch 76/100 ---

Train: 100%|██████████| 4666/4666 [04:59<00:00, 15.59it/s]
2025-11-23 06:30:06,459 - INFO - Epoch 76 Train - Loss: 0.0383, Accuracy: 0.9850, Precision: 0.9631, Recall: 0.9790

Val  : 100%|██████████| 727/727 [00:34<00:00, 20.97it/s]
2025-11-23 06:30:41,132 - INFO - Epoch 76 Val   - Loss: 2.3770, Accuracy: 0.7385, Precision: 0.6459, Recall: 0.6873
2025-11-23 06:30:41,132 - INFO - 
--- Epoch 77/100 ---

Train: 100%|██████████| 4666/4666 [04:59<00:00, 15.56it/s]
2025-11-23 06:35:40,965 - INFO - Epoch 77 Train - Loss: 0.0382, Accuracy: 0.9851, Precision: 0.9633, Recall: 0.9791

Val  : 100%|██████████| 727/727 [00:34<00:00, 20.85it/s]
2025-11-23 06:36:15,830 - INFO - Epoch 77 Val   - Loss: 2.4749, Accuracy: 0.7366, Precision: 0.6479, Recall: 0.6823
2025-11-23 06:36:15,830 - INFO - 
--- Epoch 78/100 ---

Train: 100%|██████████| 4666/4666 [05:00<00:00, 15.51it/s]
2025-11-23 06:41:16,604 - INFO - Epoch 78 Train - Loss: 0.0381, Accuracy: 0.9851, Precision: 0.9634, Recall: 0.9791

Val  : 100%|██████████| 727/727 [00:35<00:00, 20.66it/s]
2025-11-23 06:41:51,798 - INFO - Epoch 78 Val   - Loss: 2.4862, Accuracy: 0.7307, Precision: 0.6431, Recall: 0.6813
2025-11-23 06:41:51,799 - INFO - 
--- Epoch 79/100 ---

Train: 100%|██████████| 4666/4666 [05:00<00:00, 15.54it/s]
2025-11-23 06:46:51,964 - INFO - Epoch 79 Train - Loss: 0.0380, Accuracy: 0.9852, Precision: 0.9635, Recall: 0.9792

Val  : 100%|██████████| 727/727 [00:34<00:00, 20.95it/s]
2025-11-23 06:47:26,662 - INFO - Epoch 79 Val   - Loss: 2.3960, Accuracy: 0.7379, Precision: 0.6419, Recall: 0.6856
2025-11-23 06:47:26,663 - INFO - 
--- Epoch 80/100 ---

Train: 100%|██████████| 4666/4666 [05:00<00:00, 15.54it/s]
2025-11-23 06:52:26,927 - INFO - Epoch 80 Train - Loss: 0.0379, Accuracy: 0.9852, Precision: 0.9635, Recall: 0.9792

Val  : 100%|██████████| 727/727 [00:34<00:00, 20.97it/s]
2025-11-23 06:53:01,596 - INFO - Epoch 80 Val   - Loss: 2.4080, Accuracy: 0.7416, Precision: 0.6499, Recall: 0.6884
2025-11-23 06:53:01,596 - INFO - 
--- Epoch 81/100 ---

Train: 100%|██████████| 4666/4666 [04:58<00:00, 15.63it/s]
2025-11-23 06:58:00,088 - INFO - Epoch 81 Train - Loss: 0.0378, Accuracy: 0.9852, Precision: 0.9637, Recall: 0.9793

Val  : 100%|██████████| 727/727 [00:35<00:00, 20.64it/s]
2025-11-23 06:58:35,314 - INFO - Epoch 81 Val   - Loss: 2.4656, Accuracy: 0.7332, Precision: 0.6431, Recall: 0.6771
2025-11-23 06:58:35,315 - INFO - 
--- Epoch 82/100 ---

Train: 100%|██████████| 4666/4666 [05:01<00:00, 15.50it/s]
2025-11-23 07:03:36,352 - INFO - Epoch 82 Train - Loss: 0.0377, Accuracy: 0.9853, Precision: 0.9637, Recall: 0.9793

Val  : 100%|██████████| 727/727 [00:35<00:00, 20.64it/s]
2025-11-23 07:04:11,571 - INFO - Epoch 82 Val   - Loss: 2.3455, Accuracy: 0.7393, Precision: 0.6429, Recall: 0.6898
2025-11-23 07:04:11,571 - INFO - 
--- Epoch 83/100 ---

Train: 100%|██████████| 4666/4666 [05:00<00:00, 15.52it/s]
2025-11-23 07:09:12,199 - INFO - Epoch 83 Train - Loss: 0.0376, Accuracy: 0.9853, Precision: 0.9638, Recall: 0.9794

Val  : 100%|██████████| 727/727 [00:34<00:00, 21.03it/s]
2025-11-23 07:09:46,763 - INFO - Epoch 83 Val   - Loss: 2.4312, Accuracy: 0.7371, Precision: 0.6487, Recall: 0.6813
2025-11-23 07:09:46,764 - INFO - 
--- Epoch 84/100 ---

Train: 100%|██████████| 4666/4666 [04:57<00:00, 15.66it/s]
2025-11-23 07:14:44,684 - INFO - Epoch 84 Train - Loss: 0.0376, Accuracy: 0.9853, Precision: 0.9639, Recall: 0.9794

Val  : 100%|██████████| 727/727 [00:34<00:00, 21.02it/s]
2025-11-23 07:15:19,271 - INFO - Epoch 84 Val   - Loss: 2.3910, Accuracy: 0.7362, Precision: 0.6449, Recall: 0.6864
2025-11-23 07:15:19,272 - INFO - 
--- Epoch 85/100 ---

Train: 100%|██████████| 4666/4666 [04:59<00:00, 15.60it/s]
2025-11-23 07:20:18,375 - INFO - Epoch 85 Train - Loss: 0.0375, Accuracy: 0.9854, Precision: 0.9639, Recall: 0.9794

Val  : 100%|██████████| 727/727 [00:35<00:00, 20.58it/s]
2025-11-23 07:20:53,707 - INFO - Epoch 85 Val   - Loss: 2.3849, Accuracy: 0.7375, Precision: 0.6480, Recall: 0.6847
2025-11-23 07:20:53,708 - INFO - 
--- Epoch 86/100 ---

Train: 100%|██████████| 4666/4666 [05:01<00:00, 15.49it/s]
2025-11-23 07:25:54,963 - INFO - Epoch 86 Train - Loss: 0.0375, Accuracy: 0.9854, Precision: 0.9640, Recall: 0.9794

Val  : 100%|██████████| 727/727 [00:35<00:00, 20.63it/s]
2025-11-23 07:26:30,201 - INFO - Epoch 86 Val   - Loss: 2.4582, Accuracy: 0.7371, Precision: 0.6438, Recall: 0.6841
2025-11-23 07:26:30,202 - INFO - 
--- Epoch 87/100 ---

Train: 100%|██████████| 4666/4666 [04:58<00:00, 15.63it/s]
2025-11-23 07:31:28,776 - INFO - Epoch 87 Train - Loss: 0.0373, Accuracy: 0.9855, Precision: 0.9642, Recall: 0.9795

Val  : 100%|██████████| 727/727 [00:34<00:00, 20.92it/s]
2025-11-23 07:32:03,529 - INFO - Epoch 87 Val   - Loss: 2.4105, Accuracy: 0.7357, Precision: 0.6410, Recall: 0.6784
2025-11-23 07:32:03,529 - INFO - 
--- Epoch 88/100 ---

Train: 100%|██████████| 4666/4666 [04:57<00:00, 15.66it/s]
2025-11-23 07:37:01,416 - INFO - Epoch 88 Train - Loss: 0.0372, Accuracy: 0.9855, Precision: 0.9643, Recall: 0.9796

Val  : 100%|██████████| 727/727 [00:34<00:00, 21.05it/s]
2025-11-23 07:37:35,953 - INFO - Epoch 88 Val   - Loss: 2.4322, Accuracy: 0.7336, Precision: 0.6412, Recall: 0.6799
2025-11-23 07:37:35,953 - INFO - 
--- Epoch 89/100 ---

Train: 100%|██████████| 4666/4666 [04:58<00:00, 15.64it/s]
2025-11-23 07:42:34,280 - INFO - Epoch 89 Train - Loss: 0.0371, Accuracy: 0.9855, Precision: 0.9643, Recall: 0.9796

Val  : 100%|██████████| 727/727 [00:35<00:00, 20.61it/s]
2025-11-23 07:43:09,565 - INFO - Epoch 89 Val   - Loss: 2.4554, Accuracy: 0.7369, Precision: 0.6427, Recall: 0.6830
2025-11-23 07:43:09,565 - INFO - 
--- Epoch 90/100 ---

Train: 100%|██████████| 4666/4666 [04:58<00:00, 15.63it/s]
2025-11-23 07:48:08,125 - INFO - Epoch 90 Train - Loss: 0.0370, Accuracy: 0.9856, Precision: 0.9644, Recall: 0.9796

Val  : 100%|██████████| 727/727 [00:35<00:00, 20.62it/s]
2025-11-23 07:48:43,392 - INFO - Epoch 90 Val   - Loss: 2.5251, Accuracy: 0.7344, Precision: 0.6396, Recall: 0.6778
2025-11-23 07:48:43,392 - INFO - 
--- Epoch 91/100 ---

Train: 100%|██████████| 4666/4666 [05:00<00:00, 15.51it/s]
2025-11-23 07:53:44,150 - INFO - Epoch 91 Train - Loss: 0.0370, Accuracy: 0.9856, Precision: 0.9645, Recall: 0.9797

Val  : 100%|██████████| 727/727 [00:34<00:00, 20.99it/s]
2025-11-23 07:54:18,782 - INFO - Epoch 91 Val   - Loss: 2.4250, Accuracy: 0.7400, Precision: 0.6448, Recall: 0.6869
2025-11-23 07:54:18,782 - INFO - 
--- Epoch 92/100 ---

Train: 100%|██████████| 4666/4666 [04:58<00:00, 15.63it/s]
2025-11-23 07:59:17,393 - INFO - Epoch 92 Train - Loss: 0.0369, Accuracy: 0.9856, Precision: 0.9646, Recall: 0.9797

Val  : 100%|██████████| 727/727 [00:34<00:00, 20.96it/s]
2025-11-23 07:59:52,085 - INFO - Epoch 92 Val   - Loss: 2.4427, Accuracy: 0.7387, Precision: 0.6440, Recall: 0.6886
2025-11-23 07:59:52,085 - INFO - 
--- Epoch 93/100 ---

Train: 100%|██████████| 4666/4666 [04:57<00:00, 15.67it/s]
2025-11-23 08:04:49,938 - INFO - Epoch 93 Train - Loss: 0.0368, Accuracy: 0.9857, Precision: 0.9647, Recall: 0.9798

Val  : 100%|██████████| 727/727 [00:35<00:00, 20.68it/s]
2025-11-23 08:05:25,087 - INFO - Epoch 93 Val   - Loss: 2.5195, Accuracy: 0.7382, Precision: 0.6462, Recall: 0.6847
2025-11-23 08:05:25,087 - INFO - 
--- Epoch 94/100 ---

Train: 100%|██████████| 4666/4666 [05:00<00:00, 15.52it/s]
2025-11-23 08:10:25,758 - INFO - Epoch 94 Train - Loss: 0.0368, Accuracy: 0.9857, Precision: 0.9647, Recall: 0.9798

Val  : 100%|██████████| 727/727 [00:35<00:00, 20.67it/s]
2025-11-23 08:11:00,938 - INFO - Epoch 94 Val   - Loss: 2.4958, Accuracy: 0.7411, Precision: 0.6473, Recall: 0.6870
2025-11-23 08:11:00,938 - INFO - 
--- Epoch 95/100 ---

Train: 100%|██████████| 4666/4666 [04:57<00:00, 15.68it/s]
2025-11-23 08:15:58,465 - INFO - Epoch 95 Train - Loss: 0.0367, Accuracy: 0.9857, Precision: 0.9648, Recall: 0.9798

Val  : 100%|██████████| 727/727 [00:34<00:00, 20.98it/s]
2025-11-23 08:16:33,115 - INFO - Epoch 95 Val   - Loss: 2.5330, Accuracy: 0.7349, Precision: 0.6435, Recall: 0.6813
2025-11-23 08:16:33,115 - INFO - 
--- Epoch 96/100 ---

Train: 100%|██████████| 4666/4666 [04:57<00:00, 15.70it/s]
2025-11-23 08:21:30,402 - INFO - Epoch 96 Train - Loss: 0.0366, Accuracy: 0.9858, Precision: 0.9649, Recall: 0.9799

Val  : 100%|██████████| 727/727 [00:34<00:00, 21.00it/s]
2025-11-23 08:22:05,030 - INFO - Epoch 96 Val   - Loss: 2.4372, Accuracy: 0.7394, Precision: 0.6470, Recall: 0.6845
2025-11-23 08:22:05,030 - INFO - 
--- Epoch 97/100 ---

Train: 100%|██████████| 4666/4666 [04:59<00:00, 15.60it/s]
2025-11-23 08:27:04,197 - INFO - Epoch 97 Train - Loss: 0.0365, Accuracy: 0.9858, Precision: 0.9649, Recall: 0.9799

Val  : 100%|██████████| 727/727 [00:35<00:00, 20.69it/s]
2025-11-23 08:27:39,330 - INFO - Epoch 97 Val   - Loss: 2.4584, Accuracy: 0.7394, Precision: 0.6444, Recall: 0.6906
2025-11-23 08:27:39,331 - INFO - 
--- Epoch 98/100 ---

Train: 100%|██████████| 4666/4666 [05:01<00:00, 15.45it/s]
2025-11-23 08:32:41,275 - INFO - Epoch 98 Train - Loss: 0.0365, Accuracy: 0.9858, Precision: 0.9650, Recall: 0.9799

Val  : 100%|██████████| 727/727 [00:34<00:00, 20.78it/s]
2025-11-23 08:33:16,263 - INFO - Epoch 98 Val   - Loss: 2.4795, Accuracy: 0.7376, Precision: 0.6440, Recall: 0.6774
2025-11-23 08:33:16,263 - INFO - 
--- Epoch 99/100 ---

Train: 100%|██████████| 4666/4666 [04:57<00:00, 15.68it/s]
2025-11-23 08:38:13,777 - INFO - Epoch 99 Train - Loss: 0.0363, Accuracy: 0.9858, Precision: 0.9651, Recall: 0.9800

Val  : 100%|██████████| 727/727 [00:34<00:00, 21.08it/s]
2025-11-23 08:38:48,270 - INFO - Epoch 99 Val   - Loss: 2.4757, Accuracy: 0.7368, Precision: 0.6426, Recall: 0.6802
2025-11-23 08:38:48,271 - INFO - 
--- Epoch 100/100 ---

Train: 100%|██████████| 4666/4666 [04:56<00:00, 15.75it/s]
2025-11-23 08:43:44,582 - INFO - Epoch 100 Train - Loss: 0.0363, Accuracy: 0.9859, Precision: 0.9652, Recall: 0.9800

Val  : 100%|██████████| 727/727 [00:34<00:00, 20.99it/s]
2025-11-23 08:44:19,214 - INFO - Epoch 100 Val   - Loss: 2.5836, Accuracy: 0.7328, Precision: 0.6409, Recall: 0.6813
2025-11-23 08:44:19,577 - INFO - 
Saved best model (val_loss: 1.2947) to ./best_unet.pth
2025-11-23 08:44:19,577 - INFO - 
============================================================
2025-11-23 08:44:19,577 - INFO - TRAINING SUMMARY
2025-11-23 08:44:19,577 - INFO - ============================================================
2025-11-23 08:44:19,577 - INFO - Training subjects: ['01', '04', '05', '06', '10', '19', '21', '23', '24', '25'] (10 subjects)
2025-11-23 08:44:19,577 - INFO - Validation subjects: ['17', '20'] (2 subjects)
2025-11-23 08:44:19,577 - INFO - Training samples: 37322
2025-11-23 08:44:19,577 - INFO - Validation samples: 5810
2025-11-23 08:44:19,577 - INFO - 
Final Training Metrics:
2025-11-23 08:44:19,577 - INFO -   Loss:      0.0363
2025-11-23 08:44:19,577 - INFO -   Accuracy:  0.9859
2025-11-23 08:44:19,577 - INFO -   Precision: 0.9652
2025-11-23 08:44:19,577 - INFO -   Recall:    0.9800
2025-11-23 08:44:19,577 - INFO - 
Best Validation Metrics:
2025-11-23 08:44:19,577 - INFO -   Loss:      1.2947
2025-11-23 08:44:19,578 - INFO -   Accuracy:  0.7532
2025-11-23 08:44:19,578 - INFO -   Precision: 0.6587
2025-11-23 08:44:19,578 - INFO -   Recall:    0.7418
2025-11-23 08:44:19,578 - INFO - 
Best validation loss: 1.2947
2025-11-23 08:44:19,578 - INFO - 
Training complete!
